Estado Distrito Capital. Municipio Libertador.;(0212) 576-48-42;J409156907;CARACAS
444;FARMA SALUD KASSAR C.A.;CALLE LOS INDIOS EDIF EL MIRADOR PISO PB LOCAL PB SECTOR CARABALLEDA ZONA POSTAL 1165.  Estado La Guaira. Municipio Vargas. Parroquia Caraballeda.;(0414) 303-69-20;J400914175;CARACAS
445;FARMA KHALED C.A;AV JUAN BAUTISTA ARISMENDI GTA. SOL URB. LA FLORIDA CARACAS DISTRITO CAPITAL, ZONA POSTAL 1050.  ESTADO DISTRITO CAPITAL.;(0412) 709-29-29;J412926942;CARACAS
446;FARMACIA WUISTON 45 C.A;Avenida Baralt, esquina Dos Pilitas, edificio Dos Pilitas, local A. 
Estado Distrito Capital. Municipio Libertador. Parroquia Altagracia. Caracas;(0212) 860-18-56;J411684449;CARACAS
447;FARMACIA DEL SUR C.A;CALLE LA PROVIDENCIA, EDF. MANTONI N128 LOCAL UNICO, PLANTA BAJA, EL CEMENTERIO - CARACAS. 
Estado Distrito Capital. Municipio Libertador.;(0212) 631-86-77;J001693971;CARACAS
448;FARMACIA EL INGENIO C.A;AV. PRINCIPAL DE BELLO CAMPO, CENTRO COMERCIAL BELLO CAMPO, LOCAL 19, URB, BELLO CAMPO, MUNICIPIO CHACAO. CARACAS 1060. .  Estado Miranda. Municipio;(0414) 212-14-78;J-000726671;CARACAS
449;FARMACIA SOUBLETTE C.A;AV SOUBLETTE ESQUINA QUEBRADA DE CARIACO EDIFICIO SANTA VENERE PLANTA BAJA LA GUAIRA.  Estado La Guaira. Municipio Vargas. Parroquia La Guaira.;(0416) 216-39-60;J000663238;CARACAS
450;FARMACIA ZULOAGA C.A;PROLONGACION ZULOAGA CASA N 25 LOS ROSALES. MUNC. LIBERTADOR. PARRQ. STA ROSALIA.;(0414) 325-32-02;J000802610;CARACAS
451;FARMACIA ANAUCO C.A;AV: ANDRES BELLO GUAICAIPURO CARACAS PARROQUIA EL RECREO. MUNIC. LIBERTADOR. PARRQ. ALTAGRACIA. CARACAS;(0412) 031-69-84;J002775424;CARACAS
452;FARMACIA ABELLA III C.A;AV, LA COSTANERA,URBANIZACIoN CARIBE, CENTRO COMERCIAL KROL, LOCAL 5,6 Y 7, CARABALLEDA ESTADO VARGAS..  Estado La Guaira. Municipio Vargas. Parroqui;(0424) 195-43-48;J296655065;CARACAS
453;FARMACIA CARIPE C.A.;PROLONGACION ZULOAGA ENTRE PRADO DE MARIA Y LUIS RAZETTI. EDIFICIO N 27, PB, LOCAL #1.  Estado Distrito Capital. Municipio Libertador.;(0412) 665-89-89;J313908355;CARACAS
454;INVERSIONES ABBA 308 C.A.;ESQUINA DE GRADILLAS A SOCIEDAD, EDIF HUMBOLDT, PB, LOCAL N2, PARROQUIA CATEDRAL, MUNICIPIO LIBERTADOR, CARCAS. 
Estado Distrito Capital.;(0212) 395-59-23;J412549618;CARACAS
455;FARMACIA LA ROSA MISTICA CA;CALLE REAL EDIF. FATIMA, PISO P.B. LOCAL P.B. SECTOR MAIQUETÍA ZONA POSTAL 1161;(0212) 331-00-96;J308166395;CARACAS
456;FARMACIA HNOS SABU, C.A.;CALLE NUEVA LOS DOS CERRITOS URBANIZACION 10 DE MARZO FRENTE A ABASTOS LICAR PARIATA ESTADO VARGAS.  Estado La Guaira. Municipio Vargas.;(0212) 331-89-18;J315742527;CARACAS
457;FARMACIA TU PUNTO, C.A;CALLE ESTE 3, ENTRE LAS ESQUINAS DE SOCORRO A CALERO , EDIFICIO 59-61 , P.B. N 1, PARROQUIA LA CANDELARIA, CCS DTTO CAPITAL .;(0212) 564-89-51;J314886304;CARACAS
458;AUTOFARMACIA JN CORAL C.A;AVENIDA LA COSTANERA,CON COPACABANA URB. PALMAR ESTE. EDO LA GUAIRA. MCPIO VARGAS. PARRQ CARABALLEDA.;(0414) 397-24-46;J003517216;CARACAS
459;FARMACIA SUPERFARMA L.C C.A.;AV. PRINCIPAL CC IL PREZZANO NIVEL PB LOCAL 6-7 URB. PLAYA GRANDE, CATIA LA MAR.  Estado La Guaira. Municipio Vargas. Parroquia Caraballeda.;(0212) 352-56-98;J306129421;CARACAS
460;FARMALUC 2099 C.A;CALLES DE IGLESIA A SILENCIO URB MAIQUETIA EDO VARGAS .  Estado La Guaira. Municipio Vargas. Parroquia Caraballeda.;(0412) 319-92-64;J308599000;CARACAS
461;FARMACIA FARMAMILAGROSA, C.A.;CALLE LOS HIGUEROTES CON 3ERA TRANSVERSAL, EDIF. SUCRE NO 58, LOCAL P.B. PRADO MARIA. EL CEMENTERIO.  Estado Distrito Capital. Municipio Libertador.;(0426) 916-15-16;J315501864;CARACAS
462;FARMACIA EL BRILLANTE C.A;PLAZA EL CONSUL CON CALLE MARE MAIQUETIA EDO VARGAS.  Estado La Guaira. Municipio Vargas. Parroquia MaiquetIa. Maiquetia;(0212) 331-01-64;J301017145;CARACAS
463;PHARMACY STYLE C.A;CALLE ELICE EDIF. MIS ENCANTOS PISO 3 LOCAL 1 Y 2 ZONA CHACAO CARACAS (CHACAO) MIRANDA ZONA POSTAL 1010. ESTADO MIRANDA. MUNICIPIO CHACAO.;(0412) 709-29-29;J412555243;CARACAS
464;FARMACIA DEL ESTE C.A;BOULEVARD DE SABANA GRANDE,ENTRE GALERIAS BOLIVAR Y GRAN CAFE, EDF CELESTE, LOC A.  Estado Distrito Capital. Municipio Libertador. Parroquia El Recre;(0412) 371-15-89;J-000418802;CARACAS
465;FARMACIA SANTA ROSALIA CA;AV.ESTE DOCE ESQ.DE PINTO A SANTA ROSALIA RES.CENTRO CLINICO LOCAL NRO.6 MUNICIPIO LIBERTADOR PARROQUIA SANTA TEREZA;(0212) 543-09-41;J309913719;CARACAS
466;FARMACIA JAIME SABU CA;CALLE NUEVA URBANIZACION 10 DE MARZO PARIATA ESTADO VARGAS.  Estado La Guaira. Municipio Vargas. Parroquia Carlos Soublette . Maiquetia;(0414) 901-10-61;J311806636;CARACAS
467;FARMACIA MAROY C.A;AV. LOUIS BRAILLE, CON MARIA TERESA TORO, SOCIEDAD AMIGO DE LOS CIEGOS. LAS ACACIAS..  Estado Distrito Capital. Municipio Libertador. Parroquia San P;(0212) 634-35-93;J-410887478;CARACAS
468;FARMACIA SAN SEBASTIAN, C.A;AV. HUMBOLDT, EDIFICIO CARBORO, PISO PB, URBANIZACION BELLO MONTE, CARACAS, DISTRITO CAPITAL.  Estado Distrito Capital. Municipio Libertador.;(0212) 763-19-37;J-000860114;CARACAS
469;FARMACIA POPULAR SAN ANTONIO BENDITO C.A;AV. ESTE 5 CON CRUCE AV NORTE 3, ESQ. CANONIGOS EDIF CANONIGOS, LOCAL A Y B, PARROQ ALTAGRACIA, CARACAS.;(0212) 561-61-61;J313876410;CARACAS
470;FARMACIA FARMARKET LA TRINIDAD C.A;AV. GONZALEZ RINCONES QTA. CAFEA PARCELA 160 LA TRINIDAD. EDO. MRDA. MNCPIO ACEVEDO. PARRQ EL CAFE;(0212) 945-13-88;J412229745;LISTA FMKT
471;INV. Y ADMINISTRACION DE SU FARMACIA;AV. LAS ACACIAS C/C ANDRES BELLO, EDF. FLORIDA PALACE LOCAL A, URB LA FLORIDA, CARACAS.;(0212) 730-41-22;J296074950;CARACAS
472;FARMACIA LA CARIDAD DEL COBRE GPC C.A;AV PRINCIPAL PUENTE HIERRO EDIF ADRIATICO P.B. LOCAL 1.  Estado Distrito Capital. Municipio Libertador. Parroquia Altagracia. Caracas;(0212) 543-27-45;J310504849;CARACAS
473;FARMACIA PERU C.A;CALLE COLOMBIA CON 5TA AVENIDAD SECTOR ATLANTICO. PEREZ BONALDE . CATIA.  Estado Distrito Capital. Municipio Libertador. Parroquia Altagracia. Caraca;(0212) 873-71-50;J-003277681;CARACAS
474;FARMACIA GARITA II C.A;ESQ. GARITA A CAPUCHINOS, EDIF. GARITA, PISO PB, LOCAL 6, URB. SAN JUAN, CARACAS, ZONA POSTAL 1010.  Estado Distrito Capital. Municipio Libertador.;(0212) 481-91-61;J-297287035;CARACAS
475;FARMACIA BELLO MONTE C.A;AV FINAL CASANOVA EDIF TALADRO PISO PB LOCAL B-C-F URB BELLO MONTE CARACAS DISTRITO CAPITAL ZONA POSTAL 1050;(0414) 465-35-76;J-000134090;CARACAS
476;FARMACIA ABELLA IV C.A;AV, CONSTANZA EDIFICIO CICE PISO PB LOCAL PB URBANIZACION PALMAR ESTE.  Estado La Guaira. Municipio Vargas. Parroquia Caraballeda. La Guaira;(0212) 355-89-32;J400612900;CARACAS
477;FARMACIA PLENIFARMA C.A;CALLE 01 DE BELLO MONTE CON BOULEVARD DE SABANA GRANDE, EDIF AMAPOLA, LOCAL 1, SABANA GRANDE.;(0212) 761-12-20;J401304311;CARACAS
478;INVERSIONES IMQY C.A;AV C Y E EDIF BRUSIM PISO PB LOCAL UNICO URB LA CARLOTA CARACAS MIRANDA ZONA POSTAL 1070;(0212) 239-29-80;J315067609;CARACAS
479;FARMACIA LAS PICAS C.A;AV.CAPITAN DE NAVIO FELIPE ESTEVES CON AV LAS PICAS CC PRADO DE MARIA LOCAL 29 Y 30 ;0212 6323146;J-000698465;CARACAS
481;FARMAOZONO C.A;ENTRE AV FRANCISCO DE MIRANDA Y AV FRANCISCO SOLANO, CENTRO COMERCIAL CHACAITO, LOCAL N? 147-148-149-306. 
Estado Miranda. Municipio Chacao. Parroqui;(0412) 615-46-08;J-403739285;CARACAS
482;FARMAOZONO C.A.;AVENIDA ABRHAM LINCOL ENTRE CALLE 1 Y CALLE EL RECREO, EDIFICIO SANTA ANA, PISO PLANTA BAJA. CARACAS. DISTRITO CAPITAL.;(0412) 615-46-08;J-403739285;CARACAS
483;FARMAOZONO C.A;ESQUINA DE CALERO , DESAMPARADO Y CHIMBORAZO EDF ENRIQUETA LOCAL NRO 2 PARROQUIA LA CANDELARIA CARACAS DISTRITO CAPITAL;(0414) 615-46-08;J-403739285;CARACAS
484;FARMAOZONO C.A;URB EL SILENCIO BLOQUE 4 LOCAL N 1 PB ESQUINA MARCOS PARRA AV UNIVERSIDAD. 
ESTADO DISTRITO CAPITAL MUN LIBERTADOR PARRQ SAN JUAN;(0414) 615-46-08;J-403739285;CARACAS
485;FARMAOZONO C.A;ESQUINA TRACABORDO Y MIGUELACHO LOCAL N? 100 PARROQUIA LA CANDELARIA, CARACAS DISTRITO CAPITAL;(0414) 615-46-08;J-403739285;CARACAS
486;PHARMAHORIZON 2902, CA;AV FUERZAS ARMADAS ESQ DE SOCARRAS A ROMUALDA EDF TARMA PISO PB LOCAL B. MUNCPIO LIBERTADOR. PARROQ. CATEDRAL. CCS;(0212) 564-93-77;J-404326847;CARACAS
487;DROGUERIA SANTO TOMAS 711, C.A;AV RIO NEGRO EDIF JUNCOSA PISO P.B. LOCAL S/N ZONA CENTRO PUERTO AYACUCHO ESTADO AMAZONAS ZONA POSTAL 7101.;(0424) 269-98-55;J412127691;CARACAS
488;DROGUERIA DEL OESTE, C.A.;AV. INTERCOMUNAL DE ANT?MANO 10473152. EDF. DDO. PISO PB. AL LADO DE SIDETUR. SECTOR ANTIMANO.  Estado Distrito Capital. Municipio Libertador. Parroq;(0212) 332-29-75;XX;CARACAS
489;CORPORACION MEDICA SANTA ANITA C.A.;AV NEGRIN CASA NRO 18 URBANIZACION SABANA GRANDE CARACAS DISTRITO CAPITAL ZONA POSTAL 1050;(0416) 472-12-70;J-315651661;CARACAS
490;GEORGE DRIKHA;MACARACAUY;(0424) 119-44-14;25964570;CARACAS
491;SALIDA POR AJUSTE;CARACAS;(0424) 119-44-14;0000000001;CARACAS
492;FARMACIA DE GOUVEIA S.A;AV VICTORIA C.C UNICENTRO NIVEL 1 LOCAL A-6 SECTOR CENTRO. LA VICTORIA. EDO. ARAGUA;(0244) 322-90-55;J312367946;CARACAS
493;BIOSUMINISTROS Y REACTIVOS MEDICOS ALFA, CA;AV PRINCIPAL DE LAS MERCEDES MATERNO INFANTIL CASA NRO 13 FRENTE AL SEGURO SOCIAL LA VICTORIA. EDO. ARAGUA;(0424) 348-41-72;J405906090;CARACAS
494;FARMACIA RRP C.A;CALLE PRINCIPAL URBANIZACION LLANO ALTO PLANTA ALTA LOCAL NRO 16 CARRIZAL EDO. MIRANDA;(0212) 373-25-04;J-500176597;CARACAS
495;COMERCIALIZADORA MAG ORIENTE C.A;AV COSTANERA CRUCE CON FUERZAS ARMADAS CC CAMINO REAL NIVEL FERIA LOCAL BL-44 SECTOR COSTANERA BARCELONA EDO. ANZOATEGUI;(0000) 000-00-00;J-407988794;CARACAS
496;FARMACIA MAR AZUL W&H C.A;AV PRINCIPAL CC CENTRO MAR AZUL NIVEL PB LOCAL PB-02 SECTOR CASCO CENTRAL LECHERIAS. EDO. ANZOATEGUI;(0212) 331-32-21;J-412927523;CARACAS
497;FARMACIA DONA LUISA C.A;AVE 8A NRO 91-08 SECTOR VERITAS FRENTE AL HOSPITAL DE NIÑOS MARACAIBO EDO. ZULIA;(0261) 722-14-90;J-300330044;INTERIOR
498;FARMACIA AMYRA C.A;AVENIDA 5 CON CALLE 25 CASA NRO 24-105 SECTOR EL BAJO MARACAIBO EDO. ZULIA;(0414) 363-99-54;J-309848518;INTERIOR
499;FARMACIA FARMA SAMI C.A;AV VIA DE SERVICIO LOS CHORRITOS CC KASTADIA NIVEL PB LOCAL 46-90 SECTOR TERESA CARREÑO 1 TOCUYITO.  BEJUMA EDO. CARABOBO;(0241) 853-06-42;J404171363;INTERIOR
500;FARMACIA MARIA DE SAN JOSE;CALLE URDANETA SUR LOCAL NRO 2-B SECTOR CENTRO VILLA DE CURA EDO. ARAGUA;(0244) 386-10-30;J-302947502;INTERIOR
501;DROGUERIA DROFARMA C.A;AV MANUEL DIAZ CON ARTURO MICHELENA QTA MARGARET NRO 12-A SANTA MONICA  CARACAS;(0414) 277-38-07;J-308515191;CARACAS
502;FARMACIA SANTA INES F.P;CALLE PROLONGACION JUAN DE DIOS AGRAZ CASA NRO 42 ZONA CENTRO  VILLA DE CURA EDO. ARAGUA;(0244) 386-12-78;V-162850390;INTERIOR
503;ESANTA C.A;AV TERESA DE LA PARRA CON CALLE COMERCIO EDIF ORINOCO PB LOCAL B URBANIZACION SANTA MONICA CARACAS;(0212) 693-14-80;J-000789819;CARACAS
504;FARMACIA LA BOMBILLA C.A;CALLE PRINCIPAL ANTONIO JOSE DE SUCRE PARTE ALTA  PETARE  CARACAS;(0412) 803-23-54;J-002995130;CARACAS
505;FARMADESCUENTO 23 C.A;AV 3-A CALLE COMERCIO LOCAL 1 SECTOR CENTRO DE HIGUEROTE EDO. MIRANDA;(0414) 208-22-74;J-409868125;CARACAS
506;FARMACIA EL NEGRO ANTONIO C.A;CALLE PRINCIPAL DE TACARIGUA FRENTE AL GRUPO DE ALCANTARILLA DE MANPORAL EDO. MIRANDA;(0424) 218-48-20;J-313246573;CARACAS
507;FARMACIA GRAN CARACAS C.A;AV MIRANDA LOCAL 8-C PB FRENTE A LA PLAZA 24 DE JUNIO GUATIRE EDO. MIRANDA;(0212) 341-53-83;J-306138900;CARACAS
508;FARMACIA GRAN CARACAS GUARENAS C.A;AV MARTIN VERA C.C MIRANDA NIVEL PB LOCAL 25, 26 Y 27 URB 27 DE FEBRERO. GUARENAS	 EDO. MIRANDA;(0212) 365-08-46;J-295599013;CARACAS
509;FARMACIA 9 DE DICIEMBRE C.A;AV LAS FUENTES CALLE 9 DE DICIEMBRE EDF MONTECARLO CARACAS;(0212) 451-50-55;J316253708;CARACAS
510;FARMACIA EL SANTUARIO C.A;CARRERA 10 CON CALLE 15 Y 16 EDF DON VALE PISO PB LOCAL 4 SECTOR GARBIRAS SAN CRISTOBAL EDO. TACHIRA;(0414) 710-34-41;J-401991769;CARACAS
511;FARMACIA FARMA ARMADA 24 C.A;AV FUERZAS ARMADAS SECTOR SAN LUIS A SAN JOSE FRENTE A LA ESTACION FINAL LAS FLORES DEL BUS  CARACAS;(0414) 272-75-98;J402947860;CARACAS
512;FARMACIA USMON 48 C.A;AV 2 ENTRE CALLES 2 Y 1 MONTALBAN 1 CENTRO COMERCIAL USLAR PISO 2 LOCAL 5 URBANIZACION MONTALBAN.;(0212) 471-49-88;J403563543;CARACAS
513;FARMACIA FARMARKET CENTRO USLAR C.A;AV 2 EDF CENTRO USLAR NIVEL MIRADOR PISO PB LOCAL TIENDA POR DPTO URB MONTALBAN CARACAS;(0212) 443-48-45;J-407215965;LISTA FMKT
514;FARMACIA HATIGAL C.A;AV SUR B CC PASEO EL HATILLO NIVEL 2 OF 2-03;(0212) 211-53-40;J-314195867;LISTA FMKT
515;FARMACIA FARMARKET CCCT C.A;CENTRO COMERCIAL CCCT AV PRINCIPAL CHUAO LOCAL 47-H-7 CARACAS;(0212) 959-94-82;J411381349;LISTA FMKT
516;FARMACIA FARMASAB C.A;AV CASANOVA CENTRO COMERCIAL EL RECREO NIVEL C2 LOCAL LC2.C20  CARACAS;(0414) 124-61-00;J-312216174;INTERIOR
517;FARMACIA FARMARKET LIDO C.A;AV FRANCISCO DE MIRANDA C.C. LIDO NIVEL MIRANDA LOCAL M41 EL ROSAL CARACAS;(0212) 952-20-13;J411381152;LISTA FMKT
518;FARMACIA FARMARKET TOLON C.A;AV PRINCIPAL DE LAS MERCEDES C,C TOLON FASHION MALL  CARACAS;(0212) 300-88-41;J-411380512;LISTA FMKT
519;FARMACIA CUMBRERA C.A;AV LAGO DE MARACAIBO LOCAL A-1 CENTRO COMERCIAL CUMBRES DE CURUMO  CARACAS;(0412) 901-13-85;J309709399;LISTA FMKT
520;FARMACIA ALTO NARANJO C.A;AV PRINCIPAL EL PAUJI CENTRO COMERCIAL GALERIAS LOS NARANJOS PB LOCAL 16  CARACAS;(0212) 985-52-50;J-310703981;LISTA FMKT
521;DROGUERIA INVERMED HS XX C.A;AVENIDA ERASO CENTRO PROFESIONAL SAN BERNARDINO PB LOCAL 2 CARACAS;(0212) 377-75-86;J-311525521;CARACAS
522;COMERCIALIZADORA 1106 C.A;AV CHAMA ENT CALLE GARCILAZO Y NEWTON CC POLO I TORRE A NIVEL M2 LOCAL A-1 URB COLINAS DE BELLO MONTE CARACAS;(0212) 753-90-29;J404236228;LISTA FMKT
523;FARMACIA FARMARKET CHACAITO C.A;AV ENTRE PLAZA BRION Y AV CASANOVA CC UNICO CHACAITO LOCALB1 Y B2 CARACAS;(0212) 952-28-19;J410156139;LISTA FMKT
524;FARMACIA AMAZONIA C.A;CARRERA UPATA C.C TOPACIO LOCAL PB-03 PUERTO ORDAZ EDO. BOLIVAR;(0424) 932-62-93;J-401602347;CARACAS
525;FARMACIA 701 C.A;AV 17 DE DICIEMBRE CON CALLE MADRID LOCAL 28 CIUDAD BOLIVAR EDO. BOLIVAR;(0285) 654-36-24;J-308313319;CARACAS
526;FARMACIA RIO MAR C.A;FINAL CALLE NUEVA LOCAL S/N SECTOR CASCO CENTRAL EDO. MIRANDA 50 METROS DEL HOSPITAL ERNESTO REGENER RIO CHICO EDO. MIRANDA;(0234) 872-43-22;J-301016432;CARACAS
527;FARMACIA FARMAGRANDE C.A;AV 15 DELICIAS CON CALLE 82 EDF MAYO PISO PB MARACAIBO EDO. ZULIA;(0414) 693-94-82;J-299464139;INTERIOR
528;FARMACIA FARMA EXPRESS LA PAZ C.A;AV PRINCIPAL LA PAZ LOCAL SN SECTOR BOYACA MARACAIBO EDO. ZULIA;(0414) 618-33-31;J-412666827;INTERIOR
529;FARMACIA FARMAPUNTO COROMOTO C.A;AV 40 CON CALLE 169 C.C ADIMAR NIVEL PB URB LA COROMOTO;(0414) 635-26-38;J-310794448;INTERIOR
530;FARMACIA PLAZA SALUD C.A;AV SANTA TERESA ENTRE CALLES FRONTERA Y GADEMA EDF PLAZA SALUD SECTOR CASCO CENTRAL MARACAIBO EDO. ZULIA;(0414) 355-78-98;J-406935417;INTERIOR
531;FARMACIA SOLIDARIA SUR C.A;AV 15 LOCAL 13-68 SECTOR SIERRA MAESTRA SAN FRANCISCO MARACAIBO EDO. ZULIA;(0414) 635-26-38;J-316141110;INTERIOR
532;PRIME MART FARMACIA C.A;AV 3H CON CALLE 75 CENTRO COMERCIAL PLAZA 75 NIVEL PB LOCAL SECTOR PLAZA DE LA REPUBLICA;(0412) 162-77-34;J-412894471;INTERIOR
533;FARMACIA SAN SAUL C.A;AV PRINCIPAL LA CONCEPCION SECTOR CAMPO NIQUITAO EDO. ZULIA;(0424) 642-16-25;J-401752926;INTERIOR
534;FARMACIA EL SUR C.A;CALLE 169 LOCAL 49A-08 BARRIO COLON EL SILENCIO EDO. ZULIA;(0424) 642-16-25;J-406420182;INTERIOR
535;FARMACIA FARMADOSIS C.A;AV POLAR KM 2 RICHMOND MUNICIPIO SAN FRANCISCO PARROQUIA DOMITILA FLORES MARACAIBO EDO. ZULIA;(0414) 622-34-65;J-304389299;INTERIOR
536;FARMACIA SAN ANTONIO C.A;CALLE CHOPIN CON AV LEONARDO DA VINCI EDF COLIBRI PISO PB LOCAL 2 URB LOS CHAGUARAMOS CARACAS;(0212) 753-75-46;J002125500;CARACAS
537;FARMACIA OPS C.A;AV LOS SALIAS CC OPS NIVEL 2 LOCAL 51/52 URB EL PICACHO SAN ANTONIO DE LOS ALTOS;(0414) 324-31-36;J002451785;CARACAS
538;FARMACIA JESUS MARIA Y JOSE S.R.L;"CALLE REAL LOS CORTIJOS DE SARRIA NO. 01-68.  Estado Distrito Capital. Municipio Libertador. Parroquia El Recreo. Caracas CALLE REAL LOS CORTIJOS DE;(0212) 576-94-51;J-003522252;CARACAS
539;FARMACIA Y PERFUMERIA SAN LUIS GONZAGA C.A;CALLE PANTIN AV LIBERTADOR EDF GALERIAS PANTIN PB LOCAL 03 CHACAO CARACAS;(0212) 267-98-79;J305454140;CARACAS
540;CORPORACION MAXIMEDICA 2016 C.A;CALLE PANTIN EDF ZULIA PB CHACAO CARACAS;(0424) 119-65-27;J408783975;CARACAS
541;FARMACIA SALUD INTEGRAL J&M C.A;"AVENIDA GRAN COLOMBIA CON CALLE COLON, LOCAL Nº8-2, SECTOR CENTRO, MUNICIPIO BOCONO, EDO.TRUJILLO.;(0424) 745-60-00;J-315239612;INTERIOR
542;FARMACIA PARAISO DE LOS ANDES C.A;CALLE VARGAS ENTRE AVENIDAS GUAICAIPURO Y MOTATAN, CASA S/N, SECTOR LA 40. EDO. MIRANDA;(0424) 708-13-77;J410060913;INTERIOR
543;INSUMOS MEDICOS RJ SA;CALLE LOS CLAVELES, EDIF MARCANDO CAMINO EMPRESARIAL LAS FLORES, PISO 2 OF P2 10 Y P211. URB LAS FLORES. SANTA TERESA DEL TUY EDO. MIRANDA;(0239) 514-95-47;J-406830542;CARACAS
544;FOTOPIEL C.A;AV LAS REPUBLICAS CON AV AMERICA CC ASISTENCIAL TERRAS PLAZA NIVEL COMERCIO LOCAL PB-L7 URB TERRAZAS DEL CLUB HIPICO CARACAS;(0426) 206-13-52;J403016372;CARACAS
545;FARMACIA COLON C.A;AV LOS CARMENES CON 7MA TRANSVERSAL LOS JABILLOS EL CEMENTERIO CARACAS;(0212) 608-88-16;J001450793;CARACAS
546;EXPENDIO DE MEDICINA SANTA BARBARA (BURBUSAY);CALLE JOSE MANUEL ARRAIZ SECTOR BURBUSAY TRUJILO. ESTADO TRUJILLO. MUNICIPIO BOCONO. PARROQUIA BURBUSAY.;(0424) 708-13-77;J102599728;INTERIOR
547;FARMACIA TODOSALUD MARKET, C.A.;AV PAEZ CALLEJON COROMOTO CC PLAZA REAL NIVEL PB LOCAL 13 SECTOR CENTRO;(0255) 622-55-08;J408428024;INTERIOR
548;FARMATODO C.A;AV LOS GUAYABITOS, CC EXPRESO BARUTA, PISO 5, PIEDRA AZUL, LA TRINIDAD, CARACAS;(0212) 944-80-00;J-000202001;INTERIOR
549;FARMACIA GRAN PARADA II C.A;RIO CHICO EDF EL PASO LOCAL 2 Y 3 PLANTA BAJA  SECTOR GRAN PARADA, RIO CHICO.;(0234) 872-45-06;J-311651519;CARACAS
550;INVERSIONES Z-765 C.A;Calle Bolivar con calle Comercio, edif. Alicia PB. Higuerote.;(0234) 323-27-02;J-309898531;CARACAS
551;FARMACIA GRAN VICTORIA, C.A;AV. LARA ENTRE AV. BOLVAR SUR Y AV. URDANETA. C.C CHAL NIVEL P/B LOCAL 7 SECTOR SANTA ROSA, VALENCIA  EDO CARABOBO.;(0424) 255-20-89;J409378284;INTERIOR
552;FARMACIA INTERNACIONAL C.A;EDIFICIO LUCIANA N° 4 AV.138 URB. EL VIÑEDO VALENCIA 2001 EDO CARABOBO. MUNC BEJUMA. PRRQ. NO URBANA.;(0426) 939-37-99;J075410734;INTERIOR
553;FARMACIA AINOHA C.A.;AV. 109 (ARANZAZU) LOCAL NUMERO CIVICO 78-127 BARRIO ESCALONA VALENCIA EDO. CARABOBO.;(0412) 454-38-00;J311663797;INTERIOR
554;FARMACIA MATISAN, C.A;AV. 115 C/C 10 LOCAL 2,3,4,5 URB. VILLA FLORIDA III  VALENCIA EDO. CARABOBO. PARRQ. URBANA MIGUEL PEÑA;(0414) 585-57-56;J411150630;INTERIOR
555;FARMACIA FAMA G Y P, C.A.;URB. POCATERRA, MANZANA 27. EJIDO N° 1. TOCUYITO VALENCIA EDO. CARABOBO. MUNC. LIBERTADOR. PARRQ. URBANA TOCUYITO.;(0241) 894-23-15;J400242673;INTERIOR
556;FARMACIA DESCUENTO A SU SALUD, C.A.;C.C VIRGEN DE COROMOTO LOCAL 2 SECTOR TOCUYITO, VALENCIA  EDO CARABOBO. MUNC. LIBERTADOR. PARRQ. URBANA TOCUYITO.;(0424) 365-51-09;J307480513;INTERIOR
557;FARMACIA CRISTAL, C.A.;AV. LARA ENTRE AV. BOLVAR SUR Y AV. URDANETA. C.C CHAL NIVEL P/B LOCAL 7 SECTOR SANTA ROSA, VALENCIA  EDO CARABOBO. Zona Postal 2001;(0424) 467-91-93;J075718380;INTERIOR
558;FARMACIA NORMAL NORTE C.A;AV BOLIVAR NORTE AL LADO DEL BODEGON DE CASTILLA VALENCIA 2001 EDO CARABOBO. Municipio Valencia. Parroquia Urbana San Jose. Valencia;(0414) 417-56-97;J305516588;INTERIOR
559;FARMACIA PRUEBA C.A;CARACAS;(0000) 000-00-00;J-XXXXXX;CONSIGNACION
560;FARMACIA SANTA ANA, C.A.;CENTRO, AV. LARA C/C BRICEÑO MENDEZ EDIFICIO AVENTINO LOCAL 4. PARROQUIA URBANA LA CANDELARIA MUNICIPIO VALENCIA, EDO. CARABOBO;(0414) 400-38-06;J075188667;INTERIOR
561;CENTRAL FAMA, C.A;AV. 93 LIZANDRO ALVARADO, CASA N° CIVICO 90-169 SECTOR FUNDO LA GUACAMAYA. MUNICIPIO VALENCIA, PARROQUIA URBANA CANDELARIA;(0416) 107-70-77;J412921533;INTERIOR
562;FARMACIA LA TORRE C.A;CENTRO, CALLE COLOMBIA FRENTE A LA PLAZA BOLIVAR VALENCIA. MUNICIPIO VALENCIA, EDO. CARABOBO;(0414) 342-30-48;J304154291;INTERIOR
563;FARMAMILENIUM C.A;AV. BOLIVAR CON FRANCISCO DE MIRANDA, DETRÁS DEL MERCADO MAYORISTA TOCUYITO. MUNICIPIO LIBERTADOR VALENCIA, EDO. CARABOBO;(0414) 421-09-37;J409963578;INTERIOR
564;FARMACIA BIONATURAL C. A.;AV. CEDEÑO ENTRE MONTES DE OCA Y CARABOBO CC COVI LOCAL 2, EDO. CARABOBO MUNICIPIO VALENCIA PARROQUIA URBANA EL SOCORRO;(0424) 429-06-29;J075410700;INTERIOR
565;FARMACIA LA NACION C.A.;AV 7 LOCAL 17-43SECTOR SIERRA MAESTRA MARACAIBO ESTADO ZULIA;(0424) 607-19-70;J-295326319;INTERIOR
566;FARMACIA LA PLAYA C.A;AV ANDRES EDF BLANCO ANTES DEL PUENTE DE HIGUEROTE  EDO. MIRANDA;(0234) 323-12-82;J-311529942;CARACAS
567;FARMACIA LA FUENTE DE RIO CHICO C.A;AV INTERCOMUNAL EDF AREBA PB RIO CHICO AL LADO DEL RESTAURANT AVALANCHA  EDO. MIRANDA;(0234) 872-48-52;J-309177400;CARACAS
568;FARMACIA PUERTA DE SOL C.A;CALLE MIRANDA CON CALLE BOLIVAR SAN JOSE DE BARLOVENTO  EDO. MIRANDA;(0234) 872-13-85;J-305673250;CARACAS
569;FARMACIA LOS CANALES C.A;CALLE LAS MERCEDES  RIO CHICO FRENTE A LA DISTRIBUIDORA QRL 2010  EDO. MIRANDA;(0234) 872-48-84;J-002035722;CARACAS
570;FARMACIA LAS MERCEDES DE RIO CHICO C.A;CALLE COMERCIO QUINTA MIREYE, RIO CHICO  EDO. MIRANDA;(0234) 872-42-35;J-311354948;CARACAS
571;FARMACIA EVEKAR C.A;CALLE SANTA ELENA SECTOR LAS 3 ESQUINAS  RIO CHICO  EDO. MIRANDA;(0234) 872-51-11;J-309575872;CARACAS
572;FARMACIA CARIBE MAR;AV BARLOVENTO NRO 16-06 HIGUEROTE EDO. MIRANDA;(0234) 323-52-39;V-068379160;CARACAS
573;FARMACIA CABO CODERA C.A;AV BARLOVENTO LOCAL 4-41 HIGUEROTE AL LADO DEL CINE ANTIGUO  EDO. MIRANDA;(0234) 323-02-68;J-002404205;CARACAS
574;PHARMANOVA C.A;CARRETERA PETARE-GUARENAS LOCAL NRO 518 URB TURUMO FILAS DE MARICHE EDP. MIRANDA;(0212) 244-02-35;J-411370371;CARACAS
575;FARMACIA MI TOAS 2 C.A;AV 58 N 105-09 SECTOR LA MATANCERA EDO. ZULIA;(0414) 560-88-76;J-305077851;INTERIOR
576;FARMACIA DANIVAN II C.A;CALLE IGUALDAD PORLAMAR ENTRE CALLE DIAZ Y SAN RAFAEL AL LADO DE POLLOS CACIQUE DOS A 100 METROS MUSEO NARVAEZ EDO. NUEVA ESPARTA;(0414) 563-12-66;J-303373291;INTERIOR
577;DROGUERIA DEGAR C.A;CALLE ALTO PINAR EDF CAROLINA PISO MEZZANINA OF 4 URB EL PARAISO CARACAS;(0414) 336-48-08;J-307302186;CARACAS
578;FARMACIA LA SOCIAL C.A;AV SAN FELIPE BLOQUE 83 MARACAIBO EDO. ZULIA;(0424) 640-18-68;J-298057750;INTERIOR
579;FARMACIA LAS MARIANAS C.A;CARRETERA NACIONAL CENTRO COMERCIAL DON ENRIQUE LOCAL 05 FRENTE A RESIDENCIAS VILLAS LAS MARIANAS EDO.TRUJILLO;(0412) 788-13-70;J413005271;INTERIOR
580;CENTRO CLINICO JESUS DE NAZARENO C.A;AV 58 CINCUNVALACION 2 BARRIO IXORA ROJAS MARACAIBO EDO. ZULIA;(0414) 361-55-19;J-309331680;INTERIOR
581;FARMACIA EL BIENESTAR CECILIO ACOSTA C.A;CALLE 67 EDIF TIFANNY SECTOR BELLAS ARTES MARACAIBO EDO. ZULIA;(0424) 650-56-41;J-400267803;INTERIOR
582;FARMACIA FARSILSA C.A;AV FINAL AV SIMON BOLIVAR EDIF ED SORIA PISO PB LOCAL UNICO URB LA SILSA CARACAS DISTRITO CAPITAL ZONA POSTAL 1030;(0212) 871-17-38;J-002933380;CARACAS
583;DROGUERIA QUINFARCA - 501 C.A;CALLE 157 EDF LA SALINA CASA NRO 99-20 URB EL RECREO - VALENCIA  EDI. CARABOBO;(0414) 359-50-66;J299205117;CARACAS
584;TODOHOGAR VISTAMAR C.A;AV INTERCOMUNAL JORGE RODRIGUEZ CC VISTAMAR NIVEL PB LOCAL 17 SECTOR VISTAMAR LECHERIA EDO. ANZOATEGUI;(0424) 854-45-33;J-311876103;CARACAS
586;FARMACIA ALMA MATER 1 C.A;AV ALMA MATER EDF FILIPPO PB LOCAL 01 URB LOS CHAGUARAMOS CARACAS;(0212) 661-45-61;J310476527;CARACAS
587;FARMACIA ANGELY C.A;CARRERA 16 ESQUINA CALLE 38 EDF LA FLORIDA PISO PB LOCAL 38-11 BARQUISIMETO EDO. LARA;(0251) 445-95-53;J313874060;INTERIOR
588;FARMACIA LA 19 C.A;CARRERA 19 ESQ CALLE 50 CC VENROL LOCAL B-18 BARQUISIMETO EDO. LARA;(0424) 564-60-18;J085127127;INTERIOR
589;FARMACIA SANTA ROSA EL LLANO SUCURSAL C.A;CARRERA 21 CON CALLE 20 EDF SANTA LUCIA LOCAL S/N BARQUISIMETO EDO. LARA;(0414) 567-11-68;J-405553049;CARACAS
590;FARMACIA SANTA ROSA EL LLANO C.A;AV RICAURTE CRUCE CON CALLE ARISMENDI LOCAL N 10-63 SECTOR CENTRO BARINAS EDO. BARINAS;(0414) 567-11-68;J405553049;CARACAS
