1390;FARMACIA CARMENCITA, C.A;AV. UNIVERSITARIA EDIF SANTA PAULA PISO 1-B LOCAL 1-B  URB. BELLO MONTE CARUPANO SUCRE ZONA POSTAL 6150;(0414) 760-72-47;J-411853160;INTERIOR
1391;QUE PAPAYA HIPER, C.A.;AV PRINCIPAL DE LOS RUICES (DIEGO CISNEROS) EDIF PARTY CITY PISO PB LOCAL PARTY CITY URB URB LOS RUICES CARACAS MIRANDA ZONA POSTAL 1071;(0424) 291-34-80;J500789955;CARACAS
1392;FARMACIA CARMENCITA CENTRO, C.A;CALLE CARABOBO EDIF MARY PISO PB LOCAL No. 2 ZONA CENTRO CARUPANO SUCRE ZONA POSTAL 6150;(0414) 760-72-47;J-501463212;INTERIOR
1393;FARMACIA INSUMOS EXPRESS SUCURSAL 1 (HERES);AV. BOLIVAR CRUCE CON PASEO HERES, RESIDENCIAS HERES PLANTA BAJA  LOCAL E;(0424) 907-64-66;J-400916151;INTERIOR
1394;FARMACIA MEGAMANIA, C.A;AV AVENIDA ANTONIO JOSE DE PAEZ CRUCE CON CARRERA 6 LOCAL NRO SIN NUMERO SECTOR ANTONIO JOSE DE SUCRE MATURIN MONAGAS ZONA POSTAL 6201.;(0424) 906-08-97;J-501097993;INTERIOR
1395;COMFORT FARMACIA C.A;AV BOLIVAR CON CALLE 01 LOCAL LOCAL NRO 3 URB COLINAS DE SAN DIEGO VALENCIA CARABOBO ZONA POSTAL 2006;(0414) 343-01-28;J-501436886;INTERIOR
1396;FARMACIA PLUSS BARINAS C.A;CALLE JUSTICIA CON FRENTE A LA AV RAUL BLONVAL LOPEZ CASA NRO 91-1 URB ALTO BARINAS SUR BARINAS BARINAS ZONA POSTAL 5201;(0412) 559-01-30;J-500870280;INTERIOR
1397;FARMACIA GRUPO GL C.A.;AV. PRESIDENTE MEDINA EDIF TEREPAIMA PISO PB LOCAL B URB LAS ACACIAS;(0212) 634-16-20;J-501330034;CARACAS
1398;FARMACIA FARMAEXITO ALTO BARINAS CA;AVENIDA 23 DE ENERO CRUCE CON AV LOS TOROS LOCAL S/N SECTOR ALTO BARINAS BARINAS BARINAS ZONA POSTAL 5201;(0424) 559-38-50;J-401695051;INTERIOR
1399;FARMACIA FARMAEXITO CA;CALLE CEDEÑO C/PROLONGACION CALLE CAMEJO CASA NRO 7-83 SECTOR LA CAROLINA BARINAS BARINAS ZONA POSTAL 5201;(0424) 559-38-50;J-316462943;INTERIOR
1400;FARMACIA PIE DE MONTE CA;CR 6 ESQUINA CALLE 27 CASA NRO S/N URB EL LIMONCITO BARINITAS BARINAS ZONA POSTAL 5206;(0424) 521-20-06;J-501443831;INTERIOR
1401;FARMACIA LAS BALLENAS, C.A.;AV. PRINCIPAL CRUCE CON CALLE ARAGUANEY CASA No 34 LOCAL B. LA ARBOLEDA. MARACAY EDO ARAGUA;(0414) 051-84-96;J-500460210;INTERIOR
1402;FARMACENTER CENTRO II, C.A.;CALLE VARGAS CON AVENIDA BOLIVAR, EDIFICIO INVERCOSCA II PB LOCAL 48, SECTOR CENTRO DE MARACAY.;(0414) 474-90-67;J-412894714;INTERIOR
1403;"FARMACIA GRUPO VTF, C.A.";AV AYACUCHO LOCAL CON CALLE CAJIGAL NRO 45 SECTOR
LA DEMOCRACIA MARACAY ARAGUA ZONA POSTAL 2101;(0424) 353-92-76;J-296607540;INTERIOR
1404;FARMACIA EL CANTACLARO C.A.;AV CONSTITUCION EDF CONJ RES CANTACLARO PISO PB LOCAL A SECTOR CENTRO;(0424) 341-26-07;J-294034730;INTERIOR
1405;FARMACIA CODAZZI II, CA;AV AGUSTIN CODAZZI LOCAL S/N SECTOR VISTA HERMOSA BARINAS BARINAS ZONA POSTAL 5201;(0424) 520-30-92;J-316733238;INTERIOR
1406;FARMATUYA 3, C.A.;AV, URDANETA ENTRE LA ESQUINAS CANDILITO Y URAPAL CANDILITO Y AVILANES, EDIF CENTRO COMERCIAL CANDORAL PLANTA BAJA LOCAL NO. 3, MUNICIPIO LIBERTADOR, ;(0412) 313-92-09;J-501779961;CARACAS
1407;FARMACIA SAN ANTONIO CBO C.A;AV. BOLIVAR EDIF S/N PISO P/B LOCAL S/N SECTOR PASEO ORINOCO;(0412) 499-39-95;J-501575878;INTERIOR
1408;FARMACIA LISCAM C.A.;AV NO 09 CC MERCEDES DIAZ NIVEL 01 LOCAL 08 SECTOR EL BOLO VALERA TRUJILLO ZONA POSTAL 3101;(0424) 751-18-77;J-500316828;INTERIOR
1409;FARMACENTER LITORAL 21 C.A;Av.Carlos Soublette entrada comunidad San Antonio de las flores sector el canton Maiquetia Vargas;(0414) 107-27-37;J-501618232;CARACAS
1410;FARMACIA FARMARKET LOS PALOS GRANDES, C.A.;urb. los palos grandes, 2da av. con 1ra. transversal, edif. green palace, municipio chacao, estado bolivariano de miranda. Estado Miranda. Municipio;(0212) 285-43-09;J-411804070;INTERIOR
1411;FARMACIA BARINAS IV, CA;CALLE 4 CON AVENIDA NUEVA BARINAS CASA NRO 178 URB INES BARINAS BARINAS ZONA POSTAL 5201;(0424) 577-85-89;J-501537828;INTERIOR
1412;FARMACIA BARINAS II, CA;AV 23 DE ENERO E/CALLES NICOLAS BRICEÑO Y MERIDA CASA NRO 13-87 SECTOR CENTRO BARINAS BARINAS ZONA POSTAL 5201;(0414) 555-59-68;J-400640695;INTERIOR
1413;FARMAFABIO, CA;CR 36 ENTRE AV ANDRES BELLO  Y CALLE 23 CASA NRO 23-50 LOCAL 1 SECTOR CENTRO BARQUISIMETO LARA;(0412) 076-26-13;J-500692978;INTERIOR
1414;FARMACENTER PLUS, CA;AV 6 ENTRE CALLES 8 Y  9  LOCAL NRO  2 SECTOR CENTRO QUIBOR LARA;(0424) 525-81-88;J-500912072;INTERIOR
1415;FARMACIA SAN JUDAS TADEO, C.A;CALLE PRINCIPAL DE BOQUERON, ENTRE CALLE PRINCIPAL DE LAS PIÑAS Y AVENIDA ALIRIO UGARTE PELAYO LOCAL NRO 8 SECTOR B MATURIN MONAGAS ZONA POSTAL 6201.;(0426) 430-21-67;J-080155246;INTERIOR
1416;FARMACIA LA TRIGALEÑA, C.A.;AV. CABRIALES Y PROFESIONAL TRIGALEÑA PLAZA NIVEL PB LOCAL L1-A1 URB LA TRIGALEÑA VALENCIA VALENCIA CARABOBO ZONA POSTAL 2001;(0412) 755-65-51;J-296709629;INTERIOR
1417;FARMA ACTUAL NIÑO JESUS, C.A;CTRA NACIONAL LOCAL S/N SECTOR PRIMERA SABANA EL CARMEN (BOCONO) TRUJILLO ZONA POSTAL 3103;(0426) 476-91-87;J-501029482;INTERIOR
1418;NATURAL FIT STORE;AV. PRINCIPAL LOS NARANJOS;(0424) 191-79-29;J-407473786;CARACAS
1419;FARMACORT, CA;CR 13C ENTRE AVENIDA ROTARIA LOCAL NRO S/NSECTOR OESTE BARQUISIMETO LARA;(0412) 131-85-08;J-501101531;INTERIOR
1420;FARMACIA URAMI C.A;AV.URDANETA ENTRE LAS ESQ.DE CANDILITO A PLATANAL EDF RES.DORAL CENTRO PB.LOCAL NO.6 LA CANDELARIA DTO.CAPITAL;(0414) 701-85-80;J-501128910;CARACAS
1421;INSTITUTO DIAGNOSTICO VARYNA, CA;AV RAUL BLONVAL LOPEZ CON AVENIDA VENEZUELA EDIF INSTITUTO DIAGNOSTICO VARYNA PISO PB OF S/N URB ALTO BARINAS SUR  BARINAS BARINAS ZONA POSTAL 5201;(0424) 504-31-66;J-09098356;INTERIOR
1422;FARMACIA FARMASALUD 17 DE DICIEMBRE C,A;AV 17 DE DICIEMBRE LOCAL S/N SECTOR 17 DE DICIEMBRE MUNICIPIO ANGOSTURA DEL ORINOCO CIUDAD BOLIVAR BOLIVAR;(0426) 196-23-89;J-501071527;INTERIOR
1423;FARMACIA LA ECONOMICA, C.A.;AVENIDA SUCRE LOCAL 54 Y 55 SECTOR HUECO LINDO CIUDAD BOLIVAR ESTADO BOLIVAR, MUNICIPIO HERES, PARROQUIA CATEDRAL;(0424) 915-24-10;J-3501139490;INTERIOR
1424;FARMACIA ALQUIMICA MILENIUM, C.A;AV LUISA CACERES DE ARISMENDI CASA NRO 82 BARRIO 23
DE ENERO MARACAY ARAGUA ZONA POSTAL 2103;(0424) 365-07-59;J-315043955;INTERIOR
1425;BARINTEL FARMACIA, C.A.;AV ALBERTO A TORREALBA C/C PROGRESO CC LOCATEL NIVEL Z LOCAL 68 URB JARDINES DE ALTO BARINAS, BARINAS ZONA POSTAL 5201;(0273) 541-76-99;J-314850890;INTERIOR
1426;FARMACIA LCT 18, C.A.;CALLE VARGAS EDIF PIONNER PISO PB OF PB URB BOLEITA
NORTE CARACAS MIRANDA ZONA POSTAL 1070;(0416) 031-61-28;J502022120;CARACAS
1427;FARMACIA CANDEL, C.A.;AV ESTE CC CENTRO PARQUE CARACAS NIVEL 1 LOCAL 21 URB LA CANDELARIA CARACAS DISTRITO CAPITAL ZONA POSTAL 1010;(0424) 177-60-37;J-309060457;CARACAS
1428;FARMACIA COLSALUD C.A;AV INTERCOMUNAL, ESQ VEREDA TROPICAL LOCAL S/N, SECTOR LAS CINCO BOCAS CABIMAS ZULIA ZONA POSTAL 4013;(0412) 362-87-72;J-298430958;CARACAS
1429;FARMACIA VERAMED, C.A.;AV VERACRUZ CON CALLE MADRID EDIF LOCATEL PISO PB LOCAL PARCELAS 92 Y 93 URB LAS MERCEDES CARACAS MIRANDA ZONA POSTAL 1060;(0414) 390-68-97;J309269577;CARACAS
1430;FARMACIA INSUMOS EXPRESS SUC 3;AV LIBERTADOR, LOCAL N° 2 CIUDAD BOLIVAR;(0424) 912-89-36;J-40091615-1;INTERIOR
1431;FARMACIA CENTRAL 19 C.A.;CALLE MARIÑO C/C  SUCRE CASA NRO 18 SECTOR 19 DE ABRIL TURMERO ESTADO ARAGUA;(0412) 179-98-67;J-075757904;INTERIOR
1432;FARMA TOÑA, C.A;CALLE 8-A ANTIGUA CALLE PIAR EDIF EDIFICIO CHIHANE PISO PB LOCAL 1 SECTOR CENTRO MATURIN MONAGAS ZONA POSTAL 6201.;(0424) 606-35-79;J-500595468;INTERIOR
1433;FARMACIA PODER DEL CIELO C.A.;AV. 2DA CALLE DE PROPATRIA EDIF. MOSQUITA POSO PB LOCAL A. URB PROPATRIA. CARACAS;(0414) 328-58-81;J-500718136;INTERIOR
1434;FARMA MARKET DOÑA BARBARA C.A;AV 1 CASA NRO 2 BARRIO COROMOTO 1 SECTOR 5 (ANTES JOSE FELIZ RIBAS) MARACAY ESTADO ARAGUA;(0412) 910-96-78;J-408392046;INTERIOR
1435;FARMACIA BAMA C.A;AV ARTURO MICHELENA CALLE CODAZZI STA MONICA  CARACAS;(0212) 693-25-69;J-304220073;CARACAS
1436;FARMACIA CPM, C.A.;AV DANIEL CAMEJO OCTAVIO CC PLAZA MAYOR EDIFICIO 3 NIVEL PB LOCAL PB-02 SECTOR COMPLEJO TURISTICO EL MORRO LECHERIAS ANZOATEGUI ZONA POSTAL 6016;(0212) 203-45-83;J-307311690;INTERIOR
1437;FARMACIA MAS QUE FARMACIA MAÑONGO;AV 3 PARCELA 11-B NRO 1 SECTOR MAÑONGO NAGUANAGUA EDO CARABOBO;(0000) 000-00-00;J-501631360;INTERIOR
1438;FARMACIA SOTAVENTO, C.A.;AV CARLOS SANDA LOCAL NRO 104-146 URB EL VIÑEDO VALENCIA CARABOBO ZONA POSTAL 2001;(0212) 203-45-83;J-299299294;INTERIOR
1439;FARMACIA SAN JOSE, C.A;AVENIDA CARABOBO EDIF 1700 PISO PISO PB LOCAL 02 ZONA CENTRO CARUPANO CARUPANO SUCRE ZONA POSTAL 6150;(0424) 852-43-97;J-501635749;INTERIOR
1440;FARMACIA CENTRO CLINICO II, C.A.;AV. 2 EDIF CENTRO CLINICO LA ISABELICA PISO PB LOCAL 2 URB LA ISABELICA, VALENCIA VALENCIA CARABOBO ZONA POSTAL 2003;(0414) 583-40-55;J-310632200;INTERIOR
1441;FARMACIA INSUMOS EXPRESS, C.A;AVENIDA ROTARIA LOCAL Nro 19 , URBANIZACION VTA HERMOSA  PARROQUIA VISTA HERMOSA  MUNICIPIO ANGOSTURA DEL ORINOCO CIUDAD BOLIVAR BOLIVAR ZONA POSTAL 8;(0414) 853-32-17;J400916151;INTERIOR
1442;FARMACIA BIOMEDICAL C.A.;CR 4TA SUR ENTRE CALLES 7 Y 8 LOCAL NRO 100 SECTOR PUEBLO NUEVO SUR EL TIGRE ANZOATEGUI ZONA POSTAL 6050;(0414) 787-17-28;J-501052883;INTERIOR
1443;FARMACIA VARINA C.A.;AV RAUL BLONVAL LOPEZ  EDIF INSTITUTO DIAGNOSTICO VARYNA PISO PA LOCAL S/N URB ALTO BARINAS  BARINAS BARINAS ZONA POSTAL 5201;(0414) 951-86-07;J-316488314;INTERIOR
1444;FARMACIA SANTA BARBARA, C.A;CALLE VALDEZ ESQUINA TRINCHERAS EDIF VISTA MAR PISO PLANTA BAJA LOCAL 01 SECTOR CENTRO GÜIRIA SUCRE ZONA POSTAL 6161;(0414) 183-59-09;J-501328820;INTERIOR
1445;FARMACIA SANTA ROSA, C.A.;AV GARGUERA E/CALLE ARAMENDI Y CEDEÑO EDIF LOS SANTARROSEÑOS NRO 7-37 PISO PB LOCAL 1 SECTOR CENTRO  BARINAS BARINAS ZONA POSTAL 5201;(0424) 531-45-12;J-090133640;INTERIOR
1446;FARMACIA FARMATORRE NAGUANAGUA, C.A;AV. AVENIDA VALENCIA CC NORTE NIVEL PB LOCAL 1,2,3,4,5 NAGUANAGUA NAGUANAGUA CARABOBO ZONA POSTAL 2005;(0241) 825-55-72;J-400743907;INTERIOR
1447;FARMACIA FARMATORRE NAGUANAGUA, C.A;CENTRO COMERCIAL Y PROFESIONALPASEO ORQUIDEA LOCALES N A-1 Y A-2 NIVEL PLANTA BAJA, MAÑONGO MUNICIPIO NAGUANAGUA, ESTADO CARABOBO ZONA POSTAL 2005;(0241) 825-55-72;J400743907;INTERIOR
1448;FARMACIA FARMATORRE NAGUANAGUA, C.A;CALLE CALLEJON MAÑONGO (176) TERRERO CIVICO N 195, PB LOCAL 01 NIVEL BIOMERCADOS URB. MAÑONGO MUNICIPIO NAGUANAGUA CARABOBO.;(0241) 825-55-72;J400743907.;INTERIOR
1449;FARMACIA BOLIVAR NORTE, C.A.;AVENIDA BOLIVAR NORTE (AV.100) CRUCE CON CALLE LOPEZ LATOUCHE, CENTRO COMERCIAL PASEO LAS ACACIAS. LOCALES 17,18,19,20 Y 21, PARROQUIA SAN JOSE. VALEN;(0241) 825-55-72;J400743907,;INTERIOR
1450;FARMACIA ABAD, C.A.;CALLE 9 DE DICIEMBRE, LOCAL 35.A NRO. PB. ZONA GUATIRE . GUATIRE MIRANDA,. ZONA POSTAL 1221. ESTADO MIRANDA. MUNICIPIO ACEVEDO. PARROQUIA ARAGUITA. AR;(0412) 581-44-23;J-302582148;CARACAS
1451;FARMACIA EL CARMEN II, C.A;CTRA PANAMERICANA CON AV BOLIVAR LOCAL NRO 47 SECTOR CENTRO SAB DE MENDOZA TRUJILLO ZONA POSTAL 3110;(0272) 669-46-32;J-409555518;INTERIOR
1452;DROGUERIA COL MEDICA SOCIEDAD ANONIMA;CTRA H LOCAL S/N SECTOR H-5 CABIMAS ZULIA ZONA POSTAL 4013 MARACAIBO;(0414) 167-97-23;J-314890638;INTERIOR
1453;FARMA PLAZA MARINA C.A;CALLE MIRANDA CC PLAZA MARINA NIVEL PB LOCAL 17 SECTOR CENTRO DE TRUJILLO MCPIO TRUJILLO TRUJILLO ZONA POSTAL 3150;(0412) 406-12-81;J-501667403;INTERIOR
1454;BOTICASHOGAR & SALUD, C.A.;AV BELLA VISTA CASA NRO 04 Y 05 URB BELLA VISTA  MATURIN MONAGAS ZONA POSTAL 6201.;(0412) 498-26-00;J-500978553;INTERIOR
1455;FARMACIA LA MORENSE, C.A.;CALLE 10 LOCAL NRO 01 URB COLINAS DE MARA , SECTOR I, MORON CARABOBO ZONA POSTAL 2051;(0424) 417-78-98;J-317185935;INTERIOR
1456;FARMACIA LAGUNA AZUL, C.A.;CARRETERA NACIONAL MORON-CORO, LOCAL SN, SECTOR CENTRO DE YARACAL;(0414) 257-82-91;J-501148597;INTERIOR
1457;FARMACIA FARMASLIN 2021 C.A;CARRETERA PETARE SANTA LUCIA, C.C. VISTA HERMOSA, NIVEL PV, LOCAL 05, SECTOR EL LIMONCITO, LA DOLORITA, MUNICIPIO SUCRE, ESTADO BOLIVARIANO DE MIRANDA;(0424) 285-00-29;J-501108269;CARACAS
1458;ALIMENTOS SANTA FE, C.A.;CALLE RIBAS LOCAL 19 SECTOR EL PUEBLO 4 ESQUINAS. ESTADO MIRANDA. MUNICIPIO GUAICAIPURO. PARROQUIA LOS TEQUES. LOS TEQUES;(0414) 919-03-16;J299522732.;CARACAS
1459;FARMACIA TOLEDO, C.A.;AV. JUAN CANCIO RODRIGUEZ LOCAL S/N SECTOR LA OTRA BANDA LA ASUNCION EDO. NUEVA ESPARTA;(0424) 881-82-39;J-294463487;INTERIOR
1460;FARMACIA LAZARO CA;CALLE PRINCIPAL CC CHACAITO NIVEL CHACAITO BLOQUE C LOCAL NRO 169 URB CHACAO CARACAS (CHACAO) MIRANDA. 
ZONA POSTAL 1060;(0212) 952-81-65;J-500692633;CARACAS
1461;MERCA FARMA, C.A.;CALLE PAEZ ENTRE BOYACA Y FARRIAR EDIF LAILA NRO 97-63 PISO S/N LOCAL S/N CENTRO DE VALENCIA VALENCIA CARABOBO ZONA POSTAL 2001;(0412) 341-35-99;J-412806912;INTERIOR
1462;DROGUERIA Y SUMINISTROS CLINICOS C.A;AV CARABOBO EDIF P F PISO 01 LOCAL S/N SECTOR CENTRO SAN FERNANDO DE APURE APURE  ZONA POSTAL 7001;(0414) 468-73-39;J-307292628;INTERIOR
1463;FARMACIA BAHIA AZUL, C.A.;CTRA VIA LAS LAPAS, LOCAL TUCACAS, S/N SECTOR 8 DE DICIEMBRE, TUCACAS FALCON ZONA POSTAL 2054;(0424) 409-77-22;J-500908180;INTERIOR
1464;FARMACIA EL TROLLY CA;CALLE LA GUAIRITA, CENTRO COMERCIAL EL TROLLY. LOCAL 1-A. URB LAS MERCEDES. Estado Miranda. Municipio Baruta. Parroquia Baruta. Caracas ;(0414) 300-21-10;J-302816882;CARACAS
1465;FARMACIA LA IDEAL G &amp L. C.A;AV 112-A (SAN JUAN) LOCAL NRO 88-56 BARRIO EUTIMIO RIVAS VALENCIA CARABOBO ZONA POSTAL 2003;(0424) 407-68-47;J-500338082;INTERIOR
1466;FARMACIA AMISTAD, CA;CALLE 13 ENTRE AVS 12 Y 13 EDIF LAS NIEVES PISO PB LOCAL COMERCIAL SECTOR LA ERMITA QUIBOR LARA;(0412) 131-85-08;J-300181383;INTERIOR
1467;PABLO EMIRO DUGARTE FARMACIA FARMA D;AV PIE DE MONTE CALLE SUIZA, CC TIERRA DORADA NIVEL P.B. LOCAL NRO 74 SECTOR ALTO BARINAS SUR BARINAS BARINAS ZONA POSTAL 5201;(0414) 954-71-04;V042614250;INTERIOR
1468;FARMEDICA, C.A.;AV 13 DE JUNIO CON LIBERTADOR CC LAS LAGRIMAS NIVEL PB LOCAL LOCATEL SECTOR CENTRO ACARIGUA EDO PORTUGUESA ACARIGUA PORTUGUESA ZONA POSTAL 3301;(0212) 203-45-83;J-313636568;INTERIOR
1469;FARMACIA 9 ENE, C.A.;AV PPAL DE LA HACIENDA SECTOR UD 3 CC CIUDAD CARICUAO NIVEL 1 LOCAL L-S URBANIZACION CARICUAO CARACAS DISTRITO CAPITAL ZONA POSTAL 1090;(0212) 203-45-83;J-311583939;CARACAS
1470;FARMACIA MI SOCIO Y YO, C.A. (SUCURSAL CORO);AVENIDA SANTA ROSA DIAGONAL A LA EMERGENCIA DEL HOSPITAL GENERAL DE CORO DR. ALFREDO VANGRIEKEN, SANTA ANA DE CORO, MUNICIPIO MIRANDA, ESTADO FALCON;(0412) 665-88-50;J-500262469;INTERIOR
1471;FARMACIA BAHIA AZUL CA;av zamora centro local s/n en chichiriviche edo falcon. 
Estado Falcon. Municipio Monseñor Iturriza. Parroquia Chichiriviche. Chichiriviche;(0424) 409-77-22;J500908180;INTERIOR
1472;FARMACIA & INSUMED SANTISIMA TRINIDAD CA;AV CRUZ PAREDES EDIF JUAN URQUIJO PISO PB LOCAL NRO 2 SECTOR CENTRO  BARINAS BARINAS ZONA POSTAL 5201;(0424) 577-60-25;J-401341713;INTERIOR
1473;ALIMENTOS SANTA FE, C.A.;AV. PRINCIPAL DEL CEMENTERIO ENTRE AV LOS TOTUMOS Y AV LOS SAMANES. PARROQUIA SANTA ROSALIA. MUNICIPIO LIBERTADOS.DISTRITO CAPITAL;(0414) 919-03-16;J/299522732;CARACAS
1474;PETS HOME C.A;AV FRANCISCO DE MIRANDA PRIMERA CALLE EL DORADO CC EL DORADO SN LOCAL 8 PETARE EDO. MIRANDA;(0424) 202-49-87;J-500358237;CARACAS
1475;FARMACIA UNICASALUD, C.A;AV CIUDAD BOLIVIA EDIF DON LUIS PISO PB LOCAL NRO 1 URB EL MILAGRO BARINAS BARINAS ZONA POSTAL 5201;(0424) 556-03-91;J-501544220;INTERIOR
1476;UNI-FARMA, C.A;CALLE VENEZUELA NRO. 122 CC UNICENTRO NIVEL P/B. LOCAL
01 SECTOR PASEO ORINOCO PARROQUIA CATEDRAL MUNICIPIO ANGOSTURA
DEL ORINOCO CIUDAD BOLIVAR BOLIV;(0412) 876-00-00;J-500816375;INTERIOR
1477;UNIDAD DE PRODUCCION FAMILIAR ¨FARMA  BARINAS¨;AV LOS LLANOS CON AV PIE DE MONTE CC TIERRA DORADA NIVEL P/B LOCAL 16 URB ALTO BARINAS SUR BARINAS BARINAS ZONA POSTAL 5201;(0414) 478-59-43;J-501513945;INTERIOR
1478;FARMACIA VALLITA DE LARA, CA;AV PROLONGACION LOS LEONES CON AVENIDA LARA EDIF CENTRO DE NEGOCIOS TORRE BEL PISO PB LOCAL 2 SECTOR ZAMURO VANO BARQUISIMETO LARA;(0424) 561-51-55;J-413128799;INTERIOR
1479;FARMACIA DROMEQUI COMPAÑÍA ANONIMA.;CALLE 96 LOCAL NRO 96-41 SECTOR SAN BLAS VALENCIA ESTADO CARABOBO ZONA POSTAL 2003;(0424) 438-93-90;J-309891570;INTERIOR
1480;FARMAHUMANA, C.A (SUCURSAL SAN FELIX);CALLE 07, LOCAL MANZANA 04, PARCELA N 01-02, URB. LOS SAMANES, UD 266, CIUDAD GUAYANA BOLIVAR, ZONA POSTAL 8050;(0286) 712-20-00;J-409957527.;INTERIOR
1481;FARMACIA AHORRO Y SALUD C.A.;AV PRINCIPAL, CALLE 6 CASA NRO 46 URB RIVERAS DEL ORINOCO, PARROQUIA AGUA SALADA, MUNICIPIO ANGOSTURA DEL ORINOCO, CIUDAD BOLIVAR BOLIVAR ZONA POSTAL ;(0412) 833-28-69;J-501912491;INTERIOR
1482;FARMACIA SANTA ROSA DE LIMA, C.A.;AV 12 ESQ CALLE 9 LOCAL TAHAN NRO 02 SECTOR CENTRO MUNICIPIO VALERA ESTADO TRUJILLO VALERA TRUJILLO ZONA POSTAL 3101;(0416) 674-81-16;J-302281555;INTERIOR
1483;INVERSIONES LA MAXIMA 3000, C.A (VILLA DE CURA);CALLE ISAIAS MEDINA ANGARITA ADIFICIO LEONARDO DA VINCI PISO PLANTA BAJA LOCAL COMERCIAL A ESTADO ARAGUA MUNICIPIO ZAMORA PARROQUIA CAPITAL ZAMORA;(0412) 993-73-85;J-401449280,,;CARACAS
1484;INVERSIONES LA MAXIMA 3000, C.A (EL VALLE);AV. INTERCOMUNAL EL VALLE, CON PROLONGACIÓN CALLE CAJIGAL Y CALLE PALMAR, CENTRO COMERCIAL EL VALLE, NIVEL 5, LOCAL A3, PARROQ. EL VALLE;(0412) 993-73-85;J-401449280.;CARACAS
1485;ALCALDIA MUNICIPIO ZAMORA;GUATIRE;(0000) 000-00-00;G-20000219-0;CARACAS
1486;BIOFARMACIA RIO DE ORO, C.A ;AV.PPAL CUMBRES DE CURUMO, EDIF SANHER, PB LOCAL A. CARACAS. Estado Miranda. Municipio Baruta. Parroquia Baruta. Caracas;(0414) 333-72-77;J-296692343;CARACAS
1487;FARMACIA PAEZ EL MERCADO CA;AV CRUZ PAREDES ENTRE AVENIDA GARQUERA Y AV ANDRE VARELA LOCAL COMERCIAL NRO 14-33 SECTOR CASCO CENTRAL BARINAS BARINAS ZONA POSTAL 5201;(0424) 336-31-98;J-308227072;INTERIOR
1488;FARMACIA UNIDAS C.A;PASAJE BARTOLOME BELLO, LOCAL N-01, PB, CALLE PARAISO.;(0414) 089-52-06;J-501118388.;INTERIOR
1489;INVER-TORRES, C.A;AV 9 CON CALLE 5 LOCAL NRO 3 SECTOR CENTRO, PARROQUIA MERCEDES DIAZ, MUNICIPIO VALERA TRUJILLO ZONA POSTAL 3101;(0414) 724-33-34;J-501027285;INTERIOR
1490;FARMALISTO, C.A.;AV BOLIVAR, ENTRE LA CALLE 20 Y CARRERA 8 LOCAL IANNA NRO 1 SECTOR CENTRO MATURIN MONAGAS ZONA POSTAL 6201.;(0414) 394-77-71;J-501908923;INTERIOR
1491;ALIMENTOS SANTA FE, C.A.....;CALLE SAN JOSE FRENTE AL CENTRO COMERCIAL COLONIAL PARROQUIA LA VEGA. DISTRITO CAPITAL. MUNICIPIO LIBERTADOR. PARROQUIA LA VEGA. CARACAS.;(0414) 919-03-76;J/299522732…....;CARACAS
1492;FARMACIA GRUPO MEDICAL SALUD, C.A;AV JOSE MARIA VARGAS LOCAL NRO 04 URB LA FLORESTA MARACAY ARAGUA ZONA POSTAL 2101;(0416) 463-65-24;J-412806564;CARACAS
1493;FARMACIA VISTA PLACE CA;AV INTERCOMUNAL GUARENAS GUATIRE.CC BUENAVENTURA VISTA PLACE,NIVEL DIVERSION LOCAL D10.D11.;(0412) 369-19-88;J-308657280;CARACAS
1494;FARMACIA FARMAMEDICA SURIA, C.A.;AV BARALT EDIF PUENTE YAGUNO PISO PB LOCAL NRO 2 URB
EL SILENCIO CARACAS DISTRITO CAPITAL ZONA POSTAL 1010;(0412) 551-10-35;J-297104461;CARACAS
1495;FARMAIGNACIO NAGUANAGUA, C.A;CALLE 190 EDIF EL SOL NRO CIVICO 100-107 Y 100-109 PISO PB LOCAL 1 BARRIO TARAPIO NAGUANAGUA CARABOBO ZONA POSTAL 2005;(0424) 421-24-33;J-501923175;INTERIOR
1496;FARMACLIP OCUMARE CA;AV LANDER CC GIRASOL, NIVEL PB LOCAL 3 SECTOR CENTRO OCUMARE DEL TUY ESTADO MIRANDA;(0424) 245-32-19;J-501015058;CARACAS
1497;GRUPO FARMA VOGA, C.A.;AV BOLIVAR CRUCE CON CALLE LIBERTAD LOCAL NRO 84 SECTOR CENTRO MARACAY ARAGUA ZONA POSTAL 2101;(0412) 681-22-29;J-501846430;CARACAS
1498;FARMACIA ANADRI C.A.;CALLE RICAURTE CON CALLE PAEZ,NRO.32,SECTOR PUEBLO DE BARUTA.;(0424) 293-62-71;J-299313262;CARACAS
1499;FARMACIA HOSPICENTRAL D&ampG, C.A;AV AVENIDA 112 E 5TA AVENIDA LOCAL NRO 90-191 BARRIO ATLAS VALENCIA ESTADO CARABOBO ZONA POSTAL 2001;(0424) 407-68-47;J-502048928;INTERIOR
1500;CUEVAS FARMACIA LA EXCELENCIA F.P.;CALLE 3 CASA 16 URBANIZACION JOSE ANTONIO PAEZ SECTOR I ETAPA I BARINAS BARINAS ZONA POSTAL 5201;(0424) 521-20-06;V-163713230;INTERIOR
1501;FARMACIA HOSPI-FARMA YHL, C.A;CALLE SAN JUAN VIANNEY C/C CALLE PLAZA LOCAL NRO 110-360 SECTOR 19 DE ABRIL VALENCIA CARABOBO  ZONA POSTAL 2003;(0414) 484-87-43;J-500985436;INTERIOR
1502;FARMADEPOT, C.A.;AV JOVITO VILLALBA EDF CONJUNTO CHAGUARAMOS PB LOCAL UNICA PAMPATAR EDO NVA ESPARTA;(0414) 126-76-15;J-501577587;INTERIOR
1503;FARMACIA FZ23, C.A.;AV FRANCIA CON AV LOS LLANOS CC DIVINA PASTORA  NIVEL PB LOCAL 1 URB ALTO BARINAS NORTE BARINAS ZONA POSTAL 5201;(0424) 512-01-51;J-405230010;INTERIOR
1504;DROGUERIA HOSPITALARIA FARMACEUTICA DE VENEZUELA (DROHOSFARVEN), C.A.;AV LOS PROCERES EDIF MINCA PISO 2 LOCAL 4 SECTOR SANTA BARBARA MERIDA MÉRIDA ZONA POSTAL 5101;(0424) 737-51-02;J-317434765;INTERIOR
1505;FARMACIA RAFAEL URDANETA C.A.;AV BOLIVAR LOCAL CENTRO RESIDENCIAL COMERCIAL GC
NRO 123 SECTOR FLOR AMARILLO BEJUMA CARABOBO ZONA POSTAL 2003;(0414) 492-45-42;J-294478670;INTERIOR
1506;INSTITUTO DE DIAGNOSTICO SAN MICHAEL 2911, CA;AV BERMUDEZ EDF TORRE ROYAL PISO 6 OF 63 SECTOR EL LLANO LOS TEQUES MIRANDA ZONA POSTAL 1201;(0414) 325-61-51;J-403640637;INTERIOR
1507;FARMACIA SOFI SALUD, C.A.;AV BOLIVAR LOCAL FRENTE A LA PLAZA 7 NRO S/N SECTOR CENTRO MATURIN MONAGAS ZONA POSTAL 6201.;(0414) 770-27-76;J-403837848;INTERIOR
1508;INVERSIONES FARMACEUTICAS LA FAMILIA C.A.;AV. SOLANO LÓPEZ, ENTRE CALLE EL CRISTO Y AV. LOS MANGUITOS EDF. DURI PB. EL RECREO CARACAS CODIGO POSTAL 1050;(0414) 634-14-61;J-501736170;CARACAS
1509;DISTRIBUIDORA FERNANDO LA TORRE;AV.EL PARQUE EDF UNION PISO 4 OFC 11 URB.LAS ACACIAS CARACAS DTTO.CAPITAL;(0412) 388-80-63;V-163201972;CARACAS
1510;COORPORACION FARMA ORO 3 C.A;AV.PAEZ CASA QTA.ERFA NRO S/N URB EL PARAISO CARACAS DISTRITO CAPITAL ZONA POSTAL 1020;(0414) 577-00-66;J-501663637;CARACAS
1511;FARMACIA FARMA RENEE, C.A..;CALLE PRINCIPAL CASA PARCELA NRO K-4 URB ALTO
BARINAS SUR, SUBSECTOR B-6 PARCELAMIENTO 7 DE SAGECO BARINAS
BARINAS ZONA POSTAL 5201;(0416) 678-24-94;J-412839373.;INTERIOR
1512;EXPENDIO DE MEDICINAS CLENDY DE CLEOTILDE BRICEÑO;CALLE SAN JOSE CASA SIN NUMERO SECTOR TOSTOS TOSTOS TRUJILLO ZONA POSTAL 3103;(0424) 719-12-70;V-043045284;INTERIOR
1513;FARMACIA LALA 3, C.A.;Av. Siegart C/C Av. Republica Edif. RC Taguapire Piso P/B local NRO 01 Sector Negro Primero Parroquia Vista Hermosa, Ciudad Bolivar Estado Bolivar;(0285) 631-72-26;J-317462190;INTERIOR
1514;FARMACIA CMCAGUA, C.A;CALLE PIAR EDIF CENTRO PIAR PISO PB LOCAL 104-84-01-01-03 SECTOR CASCO CENTRAL CAGUA ARAGUA;(0412) 482-82-39;J-403095175;INTERIOR
1515;FARMA + VIDA, C.A;CTRA NACIONAL VIA SAN JAIME LOCAL PUNTO EXPRESS NRO 4 Y 5 ZONA ZONA INDUSTRIAL MATURIN MONAGAS ZONA POSTAL 6201;(0291) 644-74-92;J-501181527;INTERIOR
1516;FARMACIA LA PASTORA C.A;AV DIAZ MORENO EDIF GUAYANA PISO 6 LOCAL 101 SECTOR CENTRO VALENCIA CARABOBO ZONA POSTAL 2001;(0412) 355-66-04;J-301636147;INTERIOR
1517;DROGUERIA E INVERSIONES FARMACEUTICAS MULTI DROGAS C.A.;AVENIDA 23 DE ENER0 CRUCE CON CALLE NICOLAS BRICEÑO EDIF 13-17 PISO P/B LOCAL S/N SECTOR CENTRO BARINAS BARINAS ZONA POSTAL 5201;(0412) 674-74-19;J-501802076;INTERIOR
1518;FARMACIA DOSISALUD, C.A;AV CEDEÑO, NRO 05, SENTIDO ESTE-OESTE, N° 101-45 LOCAL NRO L-1 SECTOR S/N VALENCIA CARABOBO ZONA POSTAL 2001;(0424) 447-00-71;J-500814011;INTERIOR
1519;FARMACIA GUATIRE CENTER, C.A;AV BERMUDEZ EDIF PARCHITO PISO PB LOCAL COMERCIAL N-10 ZONA PUEBLO DE LA CIUDAD DE GUATIRE MIRANDA ZONA POSTAL 1221. ESTADO MIRANDA. MUNICIPIO ZAMORA.;(0412) 316-15-87;J-410212144;INTERIOR
1520;FARMA TOP 2022 C.A;CALLE BOLIVAR LOCAL NO.46 SECTOR SANTA TERESA DEL TUY MIRANDA;(0424) 212-32-81;J-502021108;CARACAS
1521;FARMACIA FAMI FARMA MGM, C.A;AV PRINCIPAL LOCAL NRO 03 SECTOR VISTA ALEGRE, N° 29 MARIARA CARABOBO ZONA POSTAL 2017;(0414) 359-32-59;J-502084878;INTERIOR
1522;FARMACIA FRANLUIS C.A.;CTRA. EL JUNQUITO KM 12 EDIF FRANLUIS PISO PB LOCAL A SECTOR EL CAFETAL CARACAS ZONA POSTAL 1030;(0414) 182-82-47;J-002339969;CARACAS
1523;FARMACIA MEDITOTAL CA;AV, JOSE ANTONIO ANZOATEGUI COMPLEJO CIUDAD REAL AUTOPISTA BARCELONA- CARACAS FRENTE A SIGO BARCELONA EDO ANZOATEGUI;(0416) 991-40-18;J-302455413;INTERIOR
1524;FARMACIA MEDITOTAL CA..;PROLONGACION AV. ARISMENDI URB.  EL PEÑONAL PARCELA A-27 DIAGONAL AL BANESCO LECHERIA EDO. ANZOATEGUI;(0416) 991-40-18;J-302455413.;INTERIOR
1525;FARMACIA MEDITOTAL CA,,;AV. COSTANERA, SECTOR MAURICA, PARCELA A-3 DIAGONAL AL C.C. PUENTE REAL, BARCELONA EDO ANZOATEGUI;(0416) 991-40-18;J-302455413,,;INTERIOR
1526;FARMACIA FARMA MEDICA, C.A.;AV INDEPENDENCIA ENTRE CALLES JOSEM. VARGAS Y BOLIVAR LOCAL NRO 4-36 SECTOR VENTRO BOCONO EDO TRUJILLO BOCONO TRUJILLO ZONA POSTAL 3103;(0424) 723-94-56;J-314350978;INTERIOR
1527;FARMACIA SAN RAFAEL C.A;AVENIDA GRAN MARISCAL C.C LA PAZ, NIVEL PB,LOCAL #4, SECTOR HOSPITAL.;(0414) 777-06-17;V-029975295;INTERIOR
1528;FARMACIA MEDISTAR, C.A.;CALLE BOLIVAR LOCAL NRO. 74 Y 74-A SECTOR NO APLICA EL CONCEJO ESTADO ARAGUA;(0424) 384-30-93;J-500771541;INTERIOR
1529;FARMACIA FARMABRISAS C.A.;CALLE PPAL BRISAS DE ORIENTE CASA NRO 1 SECTOR BRISAS DE ORIENTE CARRIZAL CARRIZAL  MIRANDA ZONA POSTAL 1203;(0414) 318-12-85;J-308251925;CARACAS
1530;DROGUERIA ANDROMAX C.A.;AV PEDRO RUSO FERRER CC VASCONIA NIVEL 1 LOCAL L001 LOS TEQUES EDO MIRANDA;(0412) 700-15-68;J-500508646;CARACAS
1531;FARMACIA 1A, C.A.;CALLE IGUALDAD ENTRE BOULEVARD GOMEZ Y CALLE FRATERNIDAD LOCAL 19-36-D SECTOR CENTRO PORLAMAR;(0414) 798-62-80;J-411461156;INTERIOR
1532;FARMACIA DIANA E.A, C.A;AV PRINCIPAL EL PALITO C.C BAHIA NIVEL 11 LOCAL PB ZONA EL PALITO PUERTO CABELLO CARABOBO ZONA POSTAL 2050;(0424) 415-07-98;J-500670095;INTERIOR
1533;FARMARKET MATURIN, C.A.;AV LUIS DEL VALLE GARCIA EDIF DOÑA MARIA PISO PB LOCAL 4 SECTOR CENTRO MATURIN MONAGAS ZONA POSTAL 6201.;(0424) 969-81-14;J-413237334;INTERIOR
1534;FARMACIA LOURDES C.A.;CALLE BIDEAU #42, SECTOR EL MERCADO GUIRIA ESTADO SUCRE, MUNICIPIO ANDRES ELOY BLANCO, PARROQUIA MARIÑO, ARAYA.;(0412) 115-36-68;J-314398890;INTERIOR
1535;DROGUERIA MEDIFARMA,C.A;AV LUIS DEL VALLE GARCIA ANTIGUA CARRERA 9-A EDIF CENTRO EMPRESARIAL NUEVA ESPARTA PISO MEZZANINA LOCAL . SECTOR LAS AVENIDAS MATURIN MONAGAS ZONA POS;(0412) 037-36-95;J-409856704;INTERIOR
1536;FARMACIA SANTO CRISTO LOS PANTANOS C.A;CTRA NACIONAL MOSQUEY LOCAL NRO 1 SECTOR LOS PANTANOS MOSQUEY TRUJILLO ZONA POSTAL 3103;(0272) 652-30-70;J-404009868;INTERIOR
