1;FARMACIA ADELBROS, CA;CENTRO COMERCIAL CIUDAD TAMANACO AV. LA ESTANCIA 2DA ETAPA NIVEL PB NRO. 43-H04 CHUAO EDO. MIRANDA;(0212) 236-00-55;J-308095281;CARACAS
2;FARMACIA  ADRIATICA, CA;AV. MOHEDANO, FRENTEA A LA PLAZA CHACAO LOCAL NRO 21-20-5  CARACAS - CHACAO;(0416) 621-08-81;J-002329912;CARACAS
3;FARMACIA BRISAS DE GUARENAS, CA;CALLE RICAURTE CON INTERCOMUNAL GUARENAS GUATIRE. EDIF. SAN VALERO PIDO PB LOCAL A1-A2 SECTOR VALLE VERDE GUARENA;(0212) 362-02-06;J-001251685;CARACAS
4;FARMACIA CENTRO COMERCIAL PALO VERDE PLAZA, CA;AV. CENTRAL CON CALLE COMERCIO CC. PALO VERDE PLAZA, NIVEL PB, LOCAL 1-12 SECTOR PALO VERDE - CARACAS (PETARE) MIRANDA;(0212) 251-99-65;J-296138087;CARACAS
5;FARMACIA  ESCORCHE, CA;CALLE  COMERCIO  NRO 20.  GUARENAS   EDO. MIRANDA;(0212) 362-46-07;J-000799440;CARACAS
6;FARMACIA FARMSA, CA;AV. FRANCISCO DE MIRANDA CC LIDER LOCAL CA-29 Y CA30 NIVEL LA CALIFORNIA  - LA CALIFORNIA EDO. MIRANDA;(0212) 236-00-55;J-294230296;CARACAS
7;FARMACIA KARLEMAR, CA;AV. PRINCIPAL LOS NARANJOS CC INDUSTRIAL LOS NARANJOS NIVEL PB LOCAL 1-18 - GUARENAS;(0212) 330-28-49;J-302849195;CARACAS
8;FARMACIA LAKE PLAZA, CA;CARRETERA NACIONAL GUARENAS-GUATIRE CENTRO AUTOMOTRIZ GUATIRE PLAZA, LOCAL NRO. 2 - GUATIRE EDO. MIRANDA;(0212) 341-27-68;J-295053266;CARACAS
9;FARMACIA LORETO, CA;CALLE MIRANDA  CON BOLIVAR  ZONA CENTRO  - OCUMARE DEL TUY;(0239) 225-76-73;J-309298186;CARACAS
10;FARMACIA LOS VALLES, CA;URB. VALLE ARRIBA C.C. VALLE ARRIBA LOCAL N1 NIVEL PB - GUATIRE;(0212) 204-28-22;J-311954457;CARACAS
11;FARMACIA  MERALI  LOS RUICES, CA;AV. FRANCISCO DE MIRANDA EDIFICIO LOS RUICES  PB;(0212) 239-75-43;J-316104028;CARACAS
12;FARMACIA MERALI  I I I,  CA;AV, PRINCIOAL EDIF SAN FELIZ PISO PB LOCAL S/N URB CAMPO CLARO      CARACAS;(0212) 239-75-43;J-315270005;CARACAS
13;FARMA OZONO, CA;AV. PRINCIPAL DE LA URBINA   SUPER CENTRO PETARE   PB  LOCAL A-2;(0212) 243-17-23;J403739285;CARACAS
14;FARMACIA PANORAMA, CA;URB LAS ROSAS C.C. LAS ROSAS NIVEL 1 LOCAL 18 Y 19 - GUATIRE;(0212) 344-99-63;J-002329297;CARACAS
15;FARMACIA PALO VERDE UNO, CA;CALLE EL COMERCIO EDIF UNO PISO PB LOCAL A URB PALO VERDE CARACA ( PETARE9 EDO. MIRANDA;(0212) 251-63-21;J-401093922;CARACAS
16;FARMA PLAZA 2015, CA;AV. RIVAS CASCO CENTRAL / OCUMARE DEL TUY EDO. MIRANDA;(0239) 225-75-80;J406371718;CARACAS
17;FARMACIA Y PERFUMERIA MAS POR MENOS, CA;AV. INTERCOMUNAL GUARENAS  CC NUEVA CASARAPA NIVEL PB LOCAL C-8 SECTOR CASARAPA GUARENAS;(0212) 427-43-13;J-400049776;CARACAS
18;FARMA SALUD TUY, CA;AV. LANDER CON CALLE SANTA ELENA, EDIF VENEZUELA PISO PB LOCAL 1 ZONA CENTRAL OCUMARE DEL TUY;0239-2244029;J-402545894;CARACAS
19;FARMACIA SAGRADO CORAZON DE JESUS, CA;AV. URIMARE CON CALLE MANAURE EDIF. ISSI  LOCALES E Y F   EL MARQUEZ  CARACAS;(0212) 235-62-92;J-293806135;CARACAS
20;FARMACIA SIENA, CA;URB. PALO ALTO, C.C. PALO ALTO LOCAL 12 Y 13  GUATIRE - EDO. MIRANDA;(0212) 347-38-55;J-308832251;CARACAS
21;FARMACIA FARMARKET HORIZONTE 2,009, CA;AV. ROMULO GALLEGOS EDIF. PEDERNALES,  PB URB HORIZONTE - CARACAS;(0212) 239-30-60;J-298301619;LISTA FMKT
22;FARMACIA FARMACHAC, CA;AV. FRANCISCO DE MIRANDA ENTRE CALLE CECILIO ACOSTA Y AV. MOHEDANO EDIF. BRICE?O NRO 36 PB;(0212) 267-14-77;J-311383620;LISTA FMKT
23;FARMACIA FARMARKET SAMBIL CARACAS, CA;AV. LIBERTADOR CC SAMBIL NIVEL AUTOPISTA LOCAL AC25 URB. CHACAO  CARACAS;(0212) 264-81-61;J-410905379;LISTA FMKT
24;FARMACIA FARMARKET PRADOS DEL  ESTE, CA;AV. AMAZONAS CON CALLE ESTANQUE CC PLAZA PRADOS  NIVEL PB LOCAL 9 URB PRADOS DEL ESTE  CARACAS;(0212) 977-73-51;J-411803219;LISTA FMKT
25;DISTRIBUIDORA MULTIMEDICA 1812. C.A;AV FRANCISCO MIRANDA CC CENTRO LIDO NIVEL GALERIA
LOCAL G-1 URB EL ROSAL CARACAS (CHACAO) MIRANDA ZONA POSTAL 1060;(0212) 763-41-98;J-294290248;CARACAS
26;INVERHEALTH, C.A.;CALLE VILLAFLOR, EDIF. ASUNCI?N, LOCAL 03, PB. BOULEVAR DE SABANA GRANDE.. 
Estado Distrito Capital. Municipio Libertador. Parroquia El Recreo. Caraca;0212-7618471;J-313236470;CARACAS
27;UNIDAD MEDICA OCUPACIONAL, C.A;Av 61 entre calles 12 y 10 local unimedica Urb. la estrella.. 
Estado Zulia. Municipio Maracaibo. Parroquia Olegario Villalobos. Maracaibo;0212-7002366;J-315796058;CARACAS
28;URIEL INSUMOS, C.A. ;CALLE EL COLEGIO, ENTRE AVENIDAS CASANOVA Y VENEZUELA, EDIFICIO CENTRO CLAVE, PISO 1, OFICINA 1A, CUBICULO A-1B, URBANIZACION SAN ANTONIO, SABANA GRAN;0414-2945856;J-410772700;CARACAS
29;FARMACIA ESTEDOS C.A.;AV. PPAL. COLINAS DE BELLO MONTE CON CALLE HARWARD, EDF SAN MIGUEL, PB, LOCAL A, URB. COLINAS DE BELLO MONTE. 
Estado Miranda. Municipio Baruta. Parro;0212-7531880;J-307065290;CARACAS
30;DROGUERIA EZZI GUERRA. C.A.;CALLE 1-2 EDF. CENTRO CYANAMID PISO 3 OFICINAS 34-2 Y 34-3 SECTOR PARROQUIA SUCRE (PETARE) MIRANDA ZONA POSTAL 1070. 
Estado Miranda. Municipio Aceved;0212-2424046;J-403169780;CARACAS
31;DROGUERIA Y DISTRIBUIDORA COLMEDICA, C.A;CALLE 9, EDIF, RENZO, PISO3, OFICINA 3-B, LA URBINA, CARACAS, EDO.MIRANDA. 
Estado Miranda. Municipio Sucre. Parroquia Petare. Caracas ;0212-2426781;J-303804608;CARACAS
32;DISTRIBUIDORA AVILA CARE, CA;Edificio centro salud, piso 6, locales oficina 601 y 602. Av. Sorocaima cruce con av. Francisco Fajardo. San Bernardino;0212-5515089;J- 413011492;CARACAS
34;FARMACIA SAN AGUSTIN C.A.;CALLE ESTE ESQ EDF SALTO ANGEL PB LOCAL B URB LA CANDELARIA;(0212) 571-03-43;J-000475164;CARACAS
38;INVERSIONES MENPERCA C.A FARMACIA CONCORDIA 1;ESQUINA DE MONZON A MAMEY CASA NO 126 SANTA TERESA CARACAS;(0212) 484-14-35;J-302147344;CARACAS
39;FARMACIA DANFRA 2301 C.A.;CATIA, URBANIZACION ALTA VISTA, CALLE STADIUM, LOCAL COMERCIAL 23-32, PARROQUIA SUCRE, MUNICIPIO LIBERTADOR, CARACAS, DTTO CAPITAL;(0412) 995-24-04;J-412978969;CARACAS
40;FARMACIA FARMADENTRO C.A.;AV SUCRE CON CALLE REAL DEL MANICOMIO RESIDENCIAS EL METRO TORRE A LOCAL 1 Y 2 LA PASTORA.  Estado Distrito Capital. Municipio Libertador. Parroquia;(0212) 860-51-71;J-313623610;CARACAS
41;FARMACIA CAJIGAL C.A.;AV. ALTAMIRA CON AVILA Y PANTE?N, RESIDENCIAS AKADIA, PLANTA BAJA, LOCAL NO. 2, URBANIZACI?N SAN BERNARDINO, CARACAS, D.C.Estado Distrito Capital.?Mun;(0212) 551-53-40;J-000801037;CARACAS
42;FARMACIA TABBAN, C.A;AV. ESPA?A QUINTA ABC, PB. URB. NUEVA CARACAS, CARACAS DISTRITO CAPITAL. Estado Distrito Capital.?Municipio Libertador.?Parroquia Altagracia.?Caracas;(0424) 199-67-41;J-306617680;CARACAS
43;CIUDAD FARMACIA LU, C.A.;CALLE 1-2 EDIF. CYANAMID, PISO 3 OFIC. 34-1, URB. LA URBINA EDO MIRANDA MUNICIPIO SUCRE;(0212) 241-58-31;J-412374877;CARACAS
44;FARMACIA CENTRO PLAZA C.A.;AV. FRANCISCO DE MIRANDA, CENTRO COMERCIAL CENTRO PLAZA, NIVEL AVENIDA, LOCAL CC-32, URB, LOS PALOS GRANDES, CARACAS.;(0212) 286-41-16;J-000868492;LISTA FMKT
45;MULTIFARMACIA AGEDALCA C.A;AV. JOSE ANTONIO PAEZ, CENTRO COMERCIAL MULTIPLAZA PARAISO, NIVEL GALERIAS, LOCAL G-13, URB. EL PARAISO, CARACAS, DISTRITO CAPITAL;(0212) 452-16-39;J-297476571;CARACAS
46;FARPA S.R.L;AV. PAEZ ESQUINA VALPARAISO Y LOIRA LOCAL PB SECTOR EL PARAISO. ESTADO DISTRITO CAPITAL. MUNICIPIO LIBERTADOR 
 PARROQUIA ALTAGRACIA CARACAS;(0212) 461-85-30;J-001675248;CARACAS
47;FARMACIA BERENICE &amp M.A. C.A;AV PAEZ CON CALLE 2 QTA CARMEN NRO S/N, URBANIZACION EL PARAISO, CARACAS DISTRITO CAPITAL. 
ESTADO DISTRITO CAPITAL.;(0212) 472-89-23;J-411613797;CARACAS
48;FARMA EXPRESS LA PAZ 2020 C.A;CALLE CARABOBO CON AVENIDA OHIGGINS. EDIFICIO SAY PARK III, TORRE B. PISO PB. LOCAL 9. URBANIZACI?N LA PAZ. 
ESTADO DISTRITO CAPITAL;(0212) 471-53-47;J-298794542;CARACAS
49;FARMACIA FARMA BECA MADARIAGA, C.A;CALLE CALLEJON SANABRIA ENTRE AVENIDA PRINCIPAL Y AVENIDA EL EJERCITO QUINTA GARDENIA EL PARAiSO. ESTADO DISTRITO CAPITAL.;(0212) 451-32-64;J-412527134;CARACAS
50;FARMACIA FARMA BECA, C.A.;CALLE B CON AV. REPUBLICA, QUINTA BRISEIDA, LOCAL Nº 2 PLANTA BAJA, URBANIZACION EL PARAISO, CARACAS, DISTRITO CAPITAL;(0212) 482-71-63;J-410534567;CARACAS
51;FARMACIA FARMA SEGUNDO 24 C.A,;AVENIDA JOSE ANTONIO PAEZ, QUINTA LA CONCORDIA, LOCAL 2, URB. EL PARAISO, FRENTE A LA PLAZA WASHINGTON. EDO. DTTO CAPITAL.;(0414) 272-75-98;J-500017014;CARACAS
52;FARMACIA QUIRON SALUD C.A;CALLE LA MONTANA CON AV PAEZ EDF VICTORIA 2 PISO LOCAL URB EL PARAISO CCS DTTO CAPITAL ZONA POSTAL 1020. EDO DTTO CAPITAL.;(0424) 127-17-27;J-413221560;CARACAS
54;INVERSIONES FARMAX 2030 C A;CALLE TRANSVERSALES 3-6-2-E Y 3-6-1-E, UNIDAD VECINAL 3 C.C CARACAS NIVEL 1 LOCAL 4, URB. MONTALBAN, CARACAS DTTO CAPITAL.;(0212) 442-24-24;J-412377256;CARACAS
55;FARMACIA CONSIGO 55, C.A;CENTRO COMERCIAL USLAR, NIVEL AVENIDA, LOCAL NO. A12, MONTALBAN, CARACAS. EDO. DTTO CAP. MUNC. LIBERTADOR. PARROQUIA ALTAGRACIA. CCS;(0424) 201-65-38;J-412161350.;CARACAS
56;FARMACIA RIO, C.A.;URBANIZACION VISTA ALEGRE EDF RIO LOCAL 1 PLANTA BAJA CALLE 2. 
ESTADO DISTRITO CAPITAL. MUNICIPIO LIBERTADOR. PARROQUIA LA VEGA. CARACAS;(0212) 217-88-31;J-310083088;CARACAS
57;FARMAHORA 24 CA;CALLE REAL LA VEGA EDIF.BRANGUS SECTOR LOS PINOS . 
ESTADO DISTRITO CAPITAL. MUNICIPIO LIBERTADOR. PARROQUIA EL PARAISO. CARACAS;(0414) 272-75-98;J-401338330;CARACAS
58;FARMACIA LOS ANGELITOS S.A;AVENIDA SAN MARTIN ESQUINA ANGELITOS A JESUS LOCAL NRO:140. 
ESTADO DISTRITO CAPITAL. MUNICIPIO LIBERTADOR. PARROQUIA ALTAGRACIA. CARACAS;(0212) 482-83-87;J-000634890;CARACAS
59;FARMACIA SALUDALEGRIA, C.A;AV SAN MARTIN EDIF BLOQUE 1 PISO PB LOCAL S/N URB EL SILENCIO . 
ESTADO DISTRITO CAPITAL. MUNICIPIO LIBERTADOR. PARROQUIA SAN JUAN. CARACAS;(0424) 139-72-57;J-412162675;CARACAS
60;INVERSIONES EGAMAR;CALLE REAL ANTIMANO. 
ESTADO DISTRITO CAPITAL. MUNICIPIO LIBERTADOR. PARROQUIA ANT?MANO. CARACAS;(0414) 171-73-20;J-310216967;CARACAS
61;FARMA DESCUENTOS ANTIMANO,C.A;CALLE ATRAS DE ANTIMANO, EDIF PRINCIPAL PISO PB LOCAL A . 
ESTADO DISTRITO CAPITAL. MUNICIPIO LIBERTADOR. PARROQUIA ANT?MANO. CARACAS;(0212) 322-33-52;J-296162387;CARACAS
62;FARMACIA BOTICA UD3 C.A.;LOCALES 50 Y 52, PB, BLOQUE N? 5, SECTOR UD3,BOULEVARD CARICUAO. ESTADO DISTRITO CAPITAL. MUNICIPIO LIBERTADOR PARROQUIA CARICUAO. CARACAS;(0212) 433-02-55;J-306077251;CARACAS
63;FARMACIA FARMAMINUTO 24 CA;7 MA AVENIDA DE CATIA EDIFICIO JOSPET P.B N?02 URB PEREZ BONALDE.
ESTADO DISTRITO CAPITAL. MUNICIPIO LIBERTADOR. PARROQUIA ALTAGRACIA. CARACAS;(0414) 272-75-98;J-402301243;CARACAS
64;FARMA DESCUENTOS PROPATRIA,C.A;CALLE PRIMERA CASA N?7 LOCAL PB URB. PROPATRIA. 
ESTADO DISTRITO CAPITAL. MUNICIPIO LIBERTADOR. PARROQUIA ALTAGRACIA. CARACAS;(0212) 324-53-38;J-296162085;CARACAS
65;FARMACIA FARMA FULL PROPATRIA, C.A.;AV 2DA CALLE DE PROPATRIA EDF. MOSQUITA PISO PB LOCAL B URB PROPATRIA CARACAS D.C.. 
ESTADO DISTRITO CAPITAL. MUNICIPIO LIBERTADOR. PARROQUIA LA PASTO;(0416) 609-37-40;J316554015;CARACAS
66;FARMACIA BARRILITO F&ampF C.A.;ESQ PARADERO A CERVECERIA EDIF BARRILITO PISO PB OF 4 URB LA CANDELARIA. EDO. DTTO CAPITAL.;(0212) 577-90-53;J-305531072;CARACAS
67;FARMACIA CENTROFASA, C.A.;CALLE SUR 15 LOCAL ENTRE ESQUINA DE PELIGRO A PELE EL OJO NRO. 26 LOCAL 26 SECTOR LA CANDELARIA CARACAS DISTRITO CAPITAL ZONA POST. 1010.;(0212) 572-59-45;J-403236623;CARACAS
68;FARMACIA FARMOI C.A;AVE. ESTE O ENTRE SUR 19 Y SUR 21, CENTRO COMERCIAL PARQUE CARACAS, P.B. LOCAL 1, LA CANDELARIA. CARACAS. 
ESTADO DISTRITO CAPITAL.;(0414) 039-48-00;J-304601980;CARACAS
69;FARMACIA LA PROVIDENCIA C.A.;CALLE GUILLERMO JOS? SCHAEL EDIF LAS FUENTES PB LOCAL 1. LA CANDELARIA. CARACASESTADO DISTRITO CAPITAL. MUNICIPIO LIBERTADOR. PARROQUIA CANDELARIA. CA;(0212) 572-41-80;J-000134634;CARACAS
70;FARMACIA DORAL C.A.;ESQUINA CERVERIA A PUENTE ANAUCO, RESIDENCIAS DORAL CARACAS. ESTADO DISTRITO CAPITAL. MUNICIPIO LIBERTADOR. PARROQUIA CANDELARIA. CARACAS;(0212) 575-33-49;J-298615788;CARACAS
71;FARMA DESCUENTOS YIBI,C.A;CALLE RIBAS N? 82, A 50 MTS PUENTE CASTRO LOS TEQUES. 
ESTADO MIRANDA. MUNICIPIO GUAICAIPURO. PARROQUIA LOS TEQUES. LOS TEQUES;(0212) 322-33-52;J-314086367;CARACAS
72;FARMACIA COLINAS DE CARRIZAL,C.A.;AV.EL LAGO COLINAS DE CARRIZAL C.C.COLINAS DE CARRIZAL PB N?B-2 URB.COLINAS DE CARRIZAL.  ESTADO MIRANDA. MUNICIPIO CARRIZAL.;(0212) 322-33-52;J002366362;CARACAS
73;FARMA DESCUENTOS SAN PEDRO C.A.;CALL NEGRO PRIMERO CASA NRO 7 AL FRENTE PLAZA ROQUE PINTO, SECTOR SAN PEDRO DE LOS ALTOS. LOS TEQUES. ESTADO MIRANDA. MUNICIPIO GUAICAIPURO. PARROQUIA;(0212) 378-02-46;J410706970;CARACAS
74;EXPENDIO DE MEDICINAS BOTICA EL JARILLO, C.A;CALLEJON ENRIQUE CC PFAVEN NIVEL 1, LOCAL D, EL JARILLO ABAJO. 
ESTADO MIRANDA. MUNICIPIO GUAICAIPURO. PARROQUIA EL JARILLO . EL JARILLO;0212 3223352;J294423493;CARACAS
75;FARMACIA CASANUEVA C.A.;CALLE GUZMAN BLANCO CON CALLE DR CARIAS EDIF LA FUENTE LOCAL 8. 
ESTADO ARAGUA. MUNICIPIO JOS? F?LIX RIBAS. PARROQUIA JOS? F?LIX RIBAS . LA VICTORIA;0212 3223352;J306816267;CARACAS
76;FARMACIAS ALIADAS, S.A.;AVENIDA LUIS ROCHE, ENTE AVE. FRANCISCO DE MIRANDA Y 2DA. TRANSVERSAL, URB. ALTAMIRA, LOCAL COMERCIAL FARMACIA FASA, MUNICIPIO CHACAO, CARACAS.;(0212) 572-59-45;J313048810;CARACAS
77;FARMACIA FARMANUTRY SUCURSAL 2;ESQUINA EL VIENTO, CALLE SUR 5, EDIF EL VIENTO, LOCAL F, PQ. STA ROSALIA, MUNICIPIO LIBERTADOR, DTTO CAPITAL.;(0412) 098-48-56;J301695500;CARACAS
78;FARMACIA FARMANUTRY SUCURSAL 3;CALLE SUCRE, ENTRE AV RICAURTE Y CALLE MARINO, EDIF ALVES, PB, LOCALES 10,11 Y 12, EDO MIRANDA.;(0212) 944-18-31;J-301695500;CARACAS
79;FARMACIA FARMANUTRY SUCURSAL 4;AV SAN CARLOS, EDIF SAN JUAN, PB, LETRA G, URB VISTA ALEGRE, PARROQUIA LA VEGA, CARACAS, DISTRITO CAPITAL.;(0412) 205-22-47;J-301695500;CARACAS
80;FARMACIA FARMARKET SAN LUIS, C.A.;AV. PRINCIPAL DE SAN LUIS, CENTRO COMERCIAL SAN LUIS, NIVEL 1, LOCAL 39-40, CARACAS, ESTADO MIRANDA, MUNICIPIO BARUTA.  Estado Miranda. Municipio Bar;(0424) 229-78-74;J411381055;LISTA FMKT
81;FARMACIA FARMARKET SANTA PAULA, C.A.;Calle acuario c.c. santa paula, nivel pb. local 1,2,3 urb santa paula caracas.  Estado Miranda. Municipio Baruta. Parroquia Baruta. Caracas;(0424) 127-85-55;J410913800;LISTA FMKT
82;FARMACIA LOS LLANOS, C.A.;AV. RAUL LEONI EDIF. NININA LOCAL 2 P.B.CHUAO CARACAS .  Estado Miranda. Municipio Baruta. Parroquia El Cafetal. Caracas;(0212) 985-29-15;J-000708827;CARACAS
83;FARMACIA TARGER, C.A.;AVENIDA PPAL DE CARIMARE C.C. CAURIMARE LOCAL PB, CAURIMARE  EDO MRDA. MUNICP. BARUTA;(0212) 985-80-44;J317033515;CARACAS
84;FARMACIA LAS MINITAS S.R.L.;CALLE LA PEDRERA CRUCE CON CALLE LAS PALMAS, RESIDENCIAS OLGA, P.B. LAS MINAS DE BARUTA, ESTADO MIRANDA.;(0212) 941-09-52;J-001851720;CARACAS
85;INVERSIONES IMQY, C.A.;AVENIDAC, CRUCE CON CALLE E, EDIFICIO BRUSIN, PLANTA BAJA, LOCAL 1. 
Estado Miranda. Municipio Sucre. Parroquia Leoncio Mart?nez. Caracas;0414-2185336;J-315067609;CARACAS
86;FARMACIA TRIACAL, C.A.;AV.1 CENTRO PROFESIONAL LOS SAMANES. LOCAL 3.URB. LOS SAMANES.CARACAS. EDO. MRDA. MPIO. BARUTA.;(0212) 941-06-46;J302225183;CARACAS
87;FARMACIA LA BOMBILLA, C.A.;Petare, San Jos? parte alta, calle principal entrada San Jos?."412803235410Joel Rodr?guez
NULLPHARMANOVA, C.A.J00299513033206Carretera Petare-;(0424) 595-14-19;J002995130;CARACAS
88;SUPERFARMA LA FLORESTA C.A.;CENTRO COMERCIAL LA ESTANCIA, NIVEL P.B. LOCAL 8A, AV. INTERCOMUNAL BARQUISIMETO ACARIGUA, SECTOR LA PIEDAD NORTE, CABUDARE ESTADO LARA. 
Estado Lara.;0412-5172083;J304693109;CARACAS
90;FARMACIA LA CHINITA DE LARA, C.A.;CARRERA 34 ENTRE 22 Y 23, LOCA NRO S/NO SECTOR HOSPITAL BARQUISIMETO LARA ZONA POSTAL 3001;(0414) 553-37-79;J-085202641;INTERIOR
91;FARMACIA EL ROSARIO, C.A.;DOMICILIO FISCAL CALLE LARA CON PADRE ZUBILLAGA EDIF DON LEOPOLDO PISO PB LOCAL 1 SECTOR CENTRO-CARORA CARORA LARA ZONA POSTAL 3050;(0416) 253-90-71;J085011951;INTERIOR
92;FARMACIA DEL NORTE, C.A.?;AVENIDA LIBERTADOR CON AVENIDA CARABOBO, PARROQUIA CATEDRAL, MUNICIPIO IRIBARREN DEL ESTADO LARA.. 
Estado Lara. Municipio Iribarren. Parroquia Catedr;0424-5899898;J303578888;CARACAS
93;FARMACIA LA 50 C.A;CARRERA 16 ESQUINA CALLE 50 LOCAL NRO 49-94 SECTOR CENTRO BARQUISIMETO. ESTADO LARA. MUNICIPIO IRIBARREN. PARRQ. CONCEPCION.;(0424) 579-50-60;J306477888;INTERIOR
94;FARMACIA SAN IGNACIO, C.A.;CARRERA 1 CON CALLE 4 N?: 4-12 BARRIO ANDRES ELOY BLANCO BARQUISIMETO ESTADO LARA .  Estado Lara. Municipio Iribarren. Parroquia Juan de Villegas. Ba;(0424) 579-50-60;J302002761;INTERIOR
95;FARMACIA YUDIBETH, C.A.;CARRERA 25 ENTRE CALLES 48 Y 49 # 48-91. ESTADO LARA. MUNICIPIO ANDRES ELOY BLANCO. PARROQUIA PTO TAMAYO. AGUADA GRANDE.;(0424) 579-50-60;J294148743;INTERIOR
96;FARMAIGNACIO CENTRO, C.A.?;AVENIDA VARGAS ENTRE CARRERAS 18 Y 19 N?: 18-36 BARQUISIMETO ESTADO LARA.  Estado Lara. Municipio Iribarren. Parroquia Catedral. Barquisimeto;(0251) 231-29-54;J307114312;INTERIOR
97;FARMACIA GIRASOL C.A?;CARRERA 15 ENTRE 35 Y 36 NUM. 35-63. 
Estado Lara. Municipio Iribarren. Parroquia Concepci?n. Barquisimeto ;0412-1557935;J302906342;CARACAS
98;FARMACIA FARMAIGNACIO BARARIDA (SUCURSAL);CALLE 9, ENTRE AVENIDA 5 Y 6, SECTOR LA MATA, PARROQUIA CABUDARE MUNICIPIO PALAVECINO. CENTRO INDUSTRIA Y SERVICIO ROS_VEN, LOCAL C-12. CABUDARE.;(0424) 579-50-60;J316880567;INTERIOR
99;FARMAIGNACIO BARARIDA, C.A.;AVENIDA LIBERTADOR CON CALLE 2 URBANIZACI?N BARARIDA VIEJA, BARQUISIMETO, MUNICIPIO IRIBARREN DEL ESTADO LARA.  Estado Lara. Municipio Iribarren. Par;(0424) 579-50-60;J316880567;INTERIOR
100;FARMACIA EL RECREO C.A.;CALLE 61 ESQUINA CARRERA 12 LOCAL NRO S/N SECTOR OESTE BARQUISIMETO LARA ZONA POSTAL 3001;(0414) 553-37-79;J-085103309;INTERIOR
101;FARMACIA DEL PILAR C.A?;AV PEDRO LEON TORRES CON CALLE 48 EDIF NUESTRA SE?ORA DEL PILAR PLANTA BAJA. 
Estado Lara. Municipio Iribarren. Parroquia Concepci?n. Barquisimeto;(0251) 445-24-13;J308693456;CARACAS
102;FARMACIA MIRANDA DEL CENTRO C.A;CARRERA 21 ESQUINA CALLE 25 S/N ZONA CENTRO BARQUISIMETO.  ESTADO LARA. MUNICIPIO ANDRES ELOY BLANCO. PARROQUIA PTO TAMAYO. AGUADA GRANDE.;(0251) 976-77-66;J302438926;INTERIOR
103;FARMACIA VARGAS C. A.;AV. VARGAS CARR. 23 Y 24 S/N ZONA CENTRO. BARQUISIMETO.  Estado Lara. Municipio Iribarren. Parroquia Catedral. Barquisimeto;(0251) 252-91-45;J085010122;INTERIOR
104;FARMACIA PAEZ;URB BARARIDA I CC VENEZUELA LOCALES 9 Y 10. ESTADO LARA. MUNICIPIO IRIBARREN. PARROQUIA CONCEPCION. BARQUISIMETO.;(0424) 587-30-29;V038605425;INTERIOR
105;LARATEL FARMACIA C.A.;CENTRO COMERCIAL LOCATEL,PB,NRO.6, AVENIDA LARA CON CALLE CAPANAPARO CABUDARE BARQUISIMETO;(0414) 530-32-86;J309862090;CARACAS
106;FARMACIA LAS DELICIAS S.R.L.;AV PPAL 5 DE JULIO CON AV ANDRES BELLO. SECTOR EL ROBLE. 
Estado Lara. Municipio Andr?s Eloy Blanco. Parroquia P?o Tamayo. Aguada Grande;0424-5424201;J301151003;CARACAS
107;FARMACIA BARRIO EL CARMEN, C.A.;CARRERA 1 ESQUINA CALLE 3 BARRIO EL CARMEN.  ESTADO LARA. MUNICIPIO IRIBARREN. PARROQUIA UNIÓN. BARQUISIMETO;(0424) 542-42-01;J085123660;INTERIOR
108;FARMACIA ARCA, C.A.;AV VARGAS ENTRE CARR 31 Y 32 CC ARCA PB LOCAL 25 Y 26. SECTOR CENTRO. 
Estado Lara. Municipio Iribarren. Parroquia Catedral. Barquisimeto ;0414-5305734;J401171249;CARACAS
109;FARMACIA D & G C.A;AVENIDA PEDRO LEON TORRES ENTRE CALLES 55 Y 55A CENTRO COMERCIAL CANAIMA PLANTA BAJA LOCAL L 35 ZONA OESTE. 
Estado Lara. Municipio Iribarren. Parroqu;0251-4482227- 448224;J309444573;CARACAS
110;FARMACIA 2019, C.A.;AV. 20 ENTRE CALLES 19 Y 20 NRO. 19-20 EDIF. FRANMER BARQUISIMETO ESTADO LARA. 
Estado Lara. Municipio Iribarren. Parroquia Uni?n. Barquisimeto;0426-8514909;J404076140;CARACAS
111;FARMACIA TORRE CRISTAL C.A;CARRERA 21 ENTRE CALLES 27 Y 28 BARQUISIMETO EDO LARA.  Estado Lara. Municipio Iribarren. Parroquia Concepci?n. Barquisimeto;(0414) 512-51-68;J297707689;INTERIOR
112;FARMACIA FARMA VIDA;CARRERA 24 CON CALLE 36 Y 37 36-15 LOCAL NRO 36-15 SECTOR CENTRO BARQUISIMETO LARA ZONA POSTAL 3001;(0412) 252-77-76;V-114293748;INTERIOR
113;FARMACIA LA LIBERTADOR DEL ESTE C.A.?;AV. LIBERTADOR CC DE SERVICIOS PARQUE LIBERTADOR NIVEL PB LOCAL 01 ZONA ESTE BARQUISIMETO.. 
Estado Lara. Municipio Iribarren. Parroquia Santa Rosa. B;0414-1595968;J296016550;CARACAS
114;FARMAINDUSTRIA, C.A. SUCURSAL?;AVENIDA PEDRO LEON TORRE, CENTRO COMERCIAL SOTAVENTO, LOCAL A-6 P6, BARQUISIMETO, EDO. LARA.  Estado Lara. Municipio Iribarren. Parroquia Juan de Vil;(0251) 935-50-82;J075468325;CARACAS
115;FARMACIA PASTORA DE LARA, C.A.;CR 24 ENTRE CALLES 20 Y 21 LOCAL LOCAL NRO 20-23
SECTOR CENTRO BARQUISIMETO LARA ZONA POSTAL 3001;(0414) 570-11-91;J-316706249;INTERIOR
116;FARMACIA ALEGRIA C.A?;CALLE 33 CON CARRERA 18 NRO S/N SECTOR CENTRO . 
Estado Lara. Municipio Iribarren. Parroquia Concepci?n. Barquisimeto;0251-2336669;J300601030;CARACAS
117;FARMACIA CURARIGUA C.A.;CALLE 50 CON AV ROOSVELT LOCAL NRO 13-17 ZONA CENTRO OESTE BARQUISIMETO LARA.  Estado Lara. Municipio Iribarren. Parroquia Concepci?n. Barquisimeto;(0424) 561-45-57;J085037837;INTERIOR
118;FARMALARA, C.A?;CARRERA 19 ESQUINA CALLE 60 SECTOR CENTRO OESTE LOCAL 2. 
Estado Lara. Municipio Iribarren. Parroquia Concepci?n. Barquisimeto;0426-5580066;J404991387];CARACAS
119;FARMACIA LOS CARDONES CA?;AV.PRINCIPAL CC LOS CARDONES NIVEL PB LOCAL 7,8,9 URB. LA ROSALEDA . 
Estado Lara. Municipio Iribarren. Parroquia Santa Rosa. Barquisimeto;0251-2544338;J085252819;CARACAS
120;FARMACIA CAJA DE AGUA C.A.;AV. 13 BOTICA CASA NRO. 46-22.  Estado Lara. Municipio Andr?s Eloy Blanco. Parroquia P?o Tamayo. Aguada Grande;(0424) 564-40-70;J085206973;INTERIOR
121;FARMACIA UNIVERSIDAD CAPPO UCLA;AV MORAN PROLONGACION LOCAL NRO 1A-49 BARRIO CRUZ BLANCA BARQUISIMETO LARA ZP 3001. EDO LARA. MNCPIO IRIBARREN. PRRQ. CATEDRAL.;(0424) 564-40-70;J315805855;INTERIOR
122;FARMACIA PROFESIONAL,C.A.?;AVENIDA 20 ESQUINA DE LA CALLE 17 EDIFICIO SILCAS PB LOCAL 01 SECTOR CENTRO BARQUISIMETO ESTADO LARA. 
Estado Lara. Municipio Iribarren. Parroquia Cat;0424-5135214;J310039372;CARACAS
123;FARMACIA LIBERTAD, C.A.;AV. LOS ABOGADOS ENTRE CALLES 14 Y 15 EDIF. EL PARQUE, BARQUISIMETO. 
Estado Lara. Municipio Iribarren. Parroquia Concepci?n. Barquisimeto ;0414-5125515;J305526222;CARACAS
124;FARMAIGNACIO LA 19 , C.A;CARRERA 19 ENTRE CALLES 41 Y 42 LOCAL N 4-56 SECTOR CENTRO. BARQUISIMETO ESTADO LARA;(0424) 503-79-35;J413049538;INTERIOR
125;FARMACIA INN, C.A?;AV LIBERTADOR ESQ CALLE DE DIOS MELEAN CASA NRO 54 CABUDARE .  ESTADO LARA. MUNICIPIO PALAVECINO. PARROQUIA CABUDARE. BARQUISIMETO;(0251) 261-56-55;J400645328;INTERIOR
126;FARMACIA LUIS MIGUEL C.A.;AVENIDA EL PLACER CENTRO COMERCIAL TRIGALPA LOCAL 3Y4 CABUDARE. ESTADO LARA. MUNICIPIO IRIBARREN. PARROQUIA CONCEPCION. CABUDARE;(0414) 973-19-84;J316031578;INTERIOR
127;FARMACIA FARMA MARKET 2011,C.A.;AV INTERCOMUNAL CABUDARE- ACARIGUA CC GRANADA NIVEL P-B LOCAL NRO 3 SECTOR LA MORA. CABUDARE EDO. LARA;(0426) 552-20-91;J400279240;INTERIOR
128;FARMACIA SANTA ANA CA;Calle 6, esquina Calle E CC Las mercedes Local A1-A4, Cabudare. Edo Lara.;(0424) 518-10-36;J085159258;INTERIOR
129;FARMACIA SAK C.A;CARRERA 19 ENTRE CALLES 29 Y 30. ESTADO LARA. MUNICIPIO IRIBARREN. PARROQUIA CONCEPCION. BARQUISIMETO;(0251) 232-96-43;J408285444;INTERIOR
130;FARMACIA LA FUNDACI?N S.R.L;AVENIDA MORAN CON CARRERA 28 SECTOR ESTE BARQUISIMETO LOCAL NRO SN  CERCA DEL DESTACAMENTO NRO. 47 GNB.. 
Estado Lara. Municipio Iribarren. Parroq;0416-6507740;J085019855;CARACAS
131;FARMACIA CLARET, C.A.;AV. PADRE VISCAYA CON AV. LIBERTADOR.  Estado Lara. Municipio Palavecino. Parroquia Agua Viva . Cabudare;(0414) 512-53-80;J085035958;INTERIOR
132;CENTRO CLINICO LA SAGRADA FAMILIA,, C.A.?;CALLE 83 CON AV 63 PROLONGACION AMPARO VIA LAS LOMAS. 
Estado Zulia. Municipio Maracaibo. Parroquia Ra?l Leoni. Maracaibo;0424-5086664;J301455100;CARACAS
133;FARMACIA F.U.L. C.A;CARR 22 CON CALL 28 EDIF. BLANCO PISO PB LOCAL 1 SECTOR CNTRO -BARQUISIMETO ZP. 3001. ESTADO LARA. MNCPIO ANDRES ELOY BLANCO.;(0416) 154-88-98;J307223073;INTERIOR
134;FARMACIA INVALMA C.A;CALLE URUGUAY CON AV EL PLACER CASA N? 23-3 UR.  VILLAS ALMA RIERA LOS RASTROJOS LARA ZONA POSTAL 3023;(0414) 350-29-01;J296889562;INTERIOR
135;FARMACIA CARORA C.A.?;CARRERA 28 ESQUINA DE LA CALLE 31 FRENTE A LA COMANDANCIA DE POLICIA. 
Estado Lara. Municipio Iribarren. Parroquia Concepci?n. Barquisimeto;0414-3574366;J303400086;CARACAS
136;FARMACIA LAS COLINAS C.A?;CARRERA 8 CON CALLE 1B COLINAS DE SANTA ROSA. 
Estado Lara. Municipio Iribarren. Parroquia Santa Rosa. Barquisimeto;0414-5223930;J085035737;CARACAS
137;FARMACIA LA 52,C.A.;CARRERA 18 ENTRE 52 Y 52 A EDIF. RESIDENCIA MAYUMA PISO PB LOCAL 2 SECTOR OESTE BARQUISIMETO. EDO LARA. MNCPIO IRIBARREN. PRRQ CONCEPCION;(0251) 446-33-73;J312240318;INTERIOR
138;FARMACIA LA DOLORITA C.A.;CALLE JUAREZ ENTRE CALLE JUAN DE DIOS PONTE Y LA CALLE VICENTE AMENGUAL LOCAL NRO S/N SECTOR CABUDARE CABUDARE.. 
Estado Lara. Municipio Iribarren. Pa;0414-5588449;J300143198;CARACAS
139;FARMACIA SAN IGNACIO DEL ESTE C.A;AV. LOS LEONES CC EL PASEO NIVEL 2 LOCAL 23 SECTOR ESTE DE LA CIUDAD DE BARQUISIMETO EDO. LARA.  Estado Lara. Municipio Iribarren. Parroquia Catedral;(0412) 059-34-56;J413044838;INTERIOR
140;FARMACIA LA PICA C.A.;AV. FRANCISCO DE MIRANDA ENTRE CALLES LIBERTAD Y CONCORDIA LOCAL NRO S/N CENTRO CARORA LARA ZONA POSTAL 3050.;(0252) 421-60-01;J413155818;INTERIOR
142;FARMACIA EL SAMAN DE TUREN C.A;CALLE JUAN MANUEL CARMONA EDIF CENTRO EMPRESARIAL EL PARQUE PISO P.B. OF 06 URB EL PARQUE BARQUISIMETO LARA ZONA POSTAL 3001;(0414) 553-37-79;J305726310;INTERIOR
143;SUPERFARMA SANARE, C.A;CALLE JUAN MANUEL CARMONA EDIF CENTRO EMPRESARIAL EL PARQUE PISO P.B. OF 06 URB EL PARQUE BARQUISIMETO LARA ZONA POSTAL 3001;0424 5270252;J305826080 ;CARACAS
144;FARMACIA PRINCIPAL PIRITU C.A;CALLE JUAN MANUEL CARMONA EDIF CENTRO EMPRESARIAL EL PARQUE PISO P.B. OF 06 URB EL PARQUE BARQUISIMETO LARA ZONA POSTAL 3001;0424 5270252;J305726302 ;CARACAS
145;SUPERFARMA PORTUGUESA C.A.;CALLE JUAN MANUEL CARMONA EDIF CENTRO EMPRESARIAL EL PARQUE PISO P.B. OF 06 URB EL PARQUE BARQUISIMETO LARA ZONA POSTAL 3001;(0414) 553-37-79;J-306583645;INTERIOR
146;FARMALARA CA;CARRERA 19 ESQUINA CALLE 60SECTOR CENTRO OESTE LOCAL 2 BARQUISIMETO EDO LARA;(0000) 000-00-00;J404991387;INTERIOR
147;FARMACIA GIRASOL CA;CARR 15 ENTRE CALLES 35 Y 36 NUMERO 35-63 BARQUISIMETO EDO LARA;(0412) 155-79-35;J302906342;INTERIOR
148;FARMACIA LA LIBERTADO DEL ESTE CA;AV LIBERTADOR CC DE SERVICIOS PARQUE LIBERTADOR NIVEL PB LOCAL 01 ZONA ESTE BARQUISIMETO EDO LARA;(0414) 576-37-76;J296016550;INTERIOR
