910;SUMINISTROS MEDICOS SICOR C.A.;AV.SOROCAIMA,CRUCE CON FRANCISCO FAJARDO, EDF.CENTRO SALUD CARACAS,URB: SAN BERNARDINO. CARACAS;(0424) 241-64-24;J-408154013;CARACAS
911;FARMACIA SAN ANTONIO, C.A.;CALLE EL SOL EDIF LAS MARIANAS PISO P/B LOCAL 01 SECTOR GUAIMARO JUANGRIEGO EDO. NUEVA ESPARTA;(0414) 798-66-58;J302278368;INTERIOR
912;FARMACIA SANTA MARIA C.A;AVENIDA BOLIVAR LOCAL 40 .  Estado Carabobo. Municipio Carlos Arvelo. Parroquia No Urbana Tacarigua. Tacarigua;(0424) 452-25-85;J075476700;INTERIOR
913;FARMACIA FARMAFULL PROPATRIA C.A.;CALLE Nº 2 EDF MOSQUITA LOCAL B,PB.PROPATRIA, CARACAS DISTRITO CAPITAL. 
Estado Distrito Capital. Municipio Libertador. Parroquia Sucre;(0414) 328-58-81;J-316554015;CARACAS
914;FARMACIA DON EMILIO C.A;AV. CARABOBO EN EL CRUCE CON LA CALLE BOYACA, CASA NO. 14-9 SECTOR BEJUMA. ESTADO CARABOBO. MUNICIPIO BEJUMA. PARROQUIA URBANA BEJUMA.;(0424) 451-97-94;J404435220;INTERIOR
915;FARMACIA RORAIMA C.A.;AV DIAZ MORENO ENTRE CALLE VARGAS Y CEDEÑO. CC DORA. NIVEL PB. LOCAL No. CIVICO 104-3. EL SOCORRO. VALENCIA. EDO CARABOBO.  Estado Carabobo. Municipi;(0424) 497-47-07;J500224141;INTERIOR
916;FARSUCAM C.A;AV RUSSO FERRER, C.C LOS TEQUES NIVEL PB LOCAL 2B SECTOR EL TAMBOR. ZONA POSTAL 1201;(0412) 256-35-04;J001806679;CARACAS
918;FARMACIA LA FE C.A;CALLE CAMALEONES CRUCE CON CALLE DESCANSO LOCAL 14-1 SECTOR CENTRO, VALLE DE LA PASCUA, ESTADO GUARICO;(0414) 335-27-01;J-060017920;INTERIOR
919;Q´FARMACIA, C.A.;AV. 105 C.C SHOOPING CENTER NIVEL PB LOCAL 101 Y 102 URB. PREBO VALENCIA EDO. CARABOBO;(0424) 437-95-42;J407107950;CARACAS
920;FARMACIA DERMO EXPRESO,C.A.;AV BOLIVAR NORTE EDIF TORRE PRINCIPAL PISO PB LOCAL 2 VALENCIA EDO CARABOBO.;(0424) 412-70-85;J500399952;CARACAS
921;FARMA CENTRO SALOMON, S.A;AV. FRANCISCO DE MIRANDA EDIFICIO SALOMON, P/B #41. SECTOR CENTRO. TEMBLADOR ESTADO MONAGAS.;(0412) 605-16-96;J312994991;INTERIOR
922;FARMACIA FARMACENTRO SALOMON, S.A.;AV. FRANCISCO DE MIRANDA, EDIFICIO SALOMÓN Nº 41, SECTOR CENTRO, TEMBLADOR - MONAGAS.;(0412) 605-16-96;J- 312994991;CARACAS
923;NEW FARMACIAS C.A;AV. ARANZAZU N° 87-39 ENTRE CALLE PLAZA Y LOPEZ.  Estado Carabobo. Municipio Valencia. Parroquia Urbana Miguel Peña. Valencia;(0241) 867-48-18;J309607553;INTERIOR
924;FARMACIA LA ROTARIA, C.A;AVENIDA PAEZ EL PARAISO, SECTOR LA ROTARIA, EDIFICIO DON ALFONZSO, PLANA BAJA. 
Estado Distrito Capital. Municipio Libertador. Parroquia EL Paraíso.;(0412) 319-71-45;J-000257523;CARACAS
925;FARMACIA HOSPITALARIA GUAYANA C.A;AV PASEO CARONI TORRE INCA PB UNARE II PUERTO ORDAZ;(0424) 185-48-39;J500395434;INTERIOR
926;FARMACIA MALAGON C.A.;AV. PRINCIPAL MALAGON C.C. PUNTO FIJO NIVEL PB LOCAL 9860, MALAGON, NAGUANAGUA, CARABOBOBO, ZONA POSTAL 2005;(0414) 958-07-57;J-075430425;CARACAS
927;LISBETH MALDONADO;BARQUISIMETO;(0414) 725-84-52;V103187784;CARACAS
928;ISAAC NAZARET MONTILLA RANGEL;TRUJILLO;(0414) 753-37-66;V264512626;INTERIOR
929;CARLOS LUIS TERIFE MADRIZ;CARACAS;(0424) 228-63-15;V-111812345;CARACAS
930;JOEL NEPTALI RODRÍGUEZ PÉREZ;CARACAS;(0412) 389-16-58;V-134668527;CARACAS
931;MANUEL ANTONIO MARVAL ZAMBRANO;VALLE LA PASCUA;(0424) 315-05-85;V-129589708;CARACAS
932;ROBERTO YSIDRO LARES BRICEÑO;CARACAS;(0414) 212-14-78;V-055791135;CARACAS
933;MARIBEL GALINDEZ MEDINA;CARACAS;(0412) 336-25-66;V-163805118;CARACAS
934;NESMAR ANDRES PAVON MENDOZA;ACARIGUA;(0414) 955-66-60;V-146765552;CARACAS
935;GENY LABRADOR;SAN CRISTOBAL;(0424) 740-95-55;V-092452618;CARACAS
936;DIEGO BLADIMIR ALVAREZ;PORLAMAR;(0414) 769-89-29;V-086470817;INTERIOR
937;CAROLINA MARIA GOMEZ RIVERA;PUERTO ORDAZ;(0424) 915-86-74;V-115124320;CARACAS
938;YULY MACHILLANDA;CARACAS;(0414) 345-35-67;V-063670967;CARACAS
939;.JOSE IGNACIO CARLOS PADILLA ABRISQUETA;CARACAS;(0414) 916-96-74;V-031847172;CARACAS
940;SANDY MAI-LING SANTIAGO SANTIAGO;CARACAS;(0412) 611-25-99;V-108173765;CARACAS
942;GERMÁN ANTONIO BRICEÑO CAMPO;MATURIN;(0424) 906-31-97;V-235322648;CARACAS
943;MARIA ANDREINA RENGEL;CUMANA;(0424) 809-10-71;V199799203;CARACAS
944;EMILIA NOGUERA;CARACAS;(0412) 613-14-92;V-90965014;CARACAS
945;JUAN CARLOS SANTIAGO LEON;EL TIGRE;(0424) 863-46-94;V-136110140;CARACAS
946;FARMACIA SINAI 235, C.A;AV. ROMULO GALLEGOS EDIF PAOLO MALAVASI PISO P/B, LOCAL S/N SECTOR CENTRO VALLE DE LA PASCUA EDO GUARICO;(0424) 359-69-54;J-405183367;INTERIOR
947;ANTONIO JOSE SANTIAGO APURE;BARQUISIMETO;(0414) 332-64-26;V-102564355;CARACAS
948;ALFREDO RENDON;PUERTO LA CRUZ;(0414) 805-24-75;V-124187342;CARACAS
949;FARMACIA FARMAMIGO IV C.A;CARRETERA PANAMERICANA KM 22C.C SUPER LIDER SECTOR LOS CERRITOS, A NIVELA AUTOMERCADO.  Estado Miranda. Municipio Carrizal . Parroquia Carrizal. Carr;(0424) 147-28-92;J317065220;CARACAS
950;FARMA SALUD KH C.A;CALLE PPAL EDF AYACUCHO PISO PB LOCAL EY D SECTOR CENTRO LOS TEQUES EDO.MIRANDA;(0412) 709-29-29;J500538375;CARACAS
951;FARMACIA VAL;Urbanizacion La Vina , Calle Juan Uslar , Qta Villa Asuncion Nro. 104 21 Valencia Estado Carabobo.  Estado Carabobo. Municipio Naguanagua . Parroquia;(0414) 662-11-52;J500310749;CARACAS
952;FARMACIA ZONA LIBRE C.A;V 4 DE MAYO, FRENTE AL HOSPITAL LUIS ORTEGA EDIF CARLOS ALBERTO LOCAL A.  Estado Nueva Esparta. Municipio Mariño. Parroquia Santiago Mariño. Porlamar;(0412) 795-85-23;J080030354;INTERIOR
953;FARMACLUB AV.VICTORIA C.A;AV. VICTORIA, EDIFICIO RESIDENCIA GRACIELA NUMERO 20-04 PISO PB LOCAL 1, SECTOR CENTRO LA VICTORIA ESTADO ARAGUA;(0424) 313-83-72;J-408046105;CARACAS
954;FARMACIA INVERSIONES FARMA 365, C.A;:	 Av españa entre 2da y 3ra Av ,Local NRO 443 Zona Boulevard de Catia .  Estado Distrito Capital. Municipio Libertador. Parroquia Sucre. Caracas;(0424) 293-47-86;J500293615;CARACAS
955;MI FARMA 2020, C.A;CALLE PAEZ. EDF. SILVANA, PISO PB, LOCAL 79 SECTOR SAN FELIX. CIUDAD GUAYANA. BOLIVAR. ZONA POSTAL 8051;(0414) 386-49-42;J500397593;INTERIOR
956;FARMACIA MEDICA C.A FARMAMEDICA;AV. PEÑALVER, EDF. S/N PISO P.B LOCAL 2B SECTOR PUEBLO NUEVONORTE EL TIGRE ANZOATEGUI;(0414) 786-24-80;J500271093;INTERIOR
957;FARMACIA INTEGRAL FARMA LOMAS DEL ESTE, C.A;AV. 90 ROTARIA CASA N|112 URB. LOMAS DEL ESTE, VALENCIA EDO CARABOBO ZONA POSTAL 2001.  Estado Carabobo. Municipio Valencia. Parroquia Urbana San Jos;(0424) 423-02-87;J412807501;INTERIOR
959;LIBIA BETZAIDA CARREÑO RIVAS;URB LA TRIGALEÑA, EDF. MONBLAN APTO 6B. PARROQUIA SAN JOSE.;(0414) 403-15-17;V112448450;CARACAS
960;LEONARDO ANTONIO CAMACHO CAMACHO;PARROQUIA SAN JOSE. URB. LOS COLORADOS, EDF. DON ANTENOR, PISO 02 PATO. 2B. VALENCIA;(0414) 424-31-44;V139504433;INTERIOR
961;WILLIAMS ANTONIO CARDENAS BARRIOS;RESIDENCIA LAS PERLAS. PISO 05 APTO 5A. TANAGUARENA;(0424) 172-47-55;V197967745;CARACAS
962;DETAL;CARACAS;(0000) 000-00-00;X;DETAL
963;INSAFARMA, C.A.;CALLE MARTINEZ CON CALLE MARCANO LOCAL S/N SECTOR CENTRO DE PORLAMAR PORLAMAR EDO. NUEVA ESPARTA;(0414) 304-95-94;J-401655092;INTERIOR
964;EINAE ADRIANA LOPEZ SANCHEZ;SAN ANTONIO DE LOS ALTOS, CALLE BOLIVAR EDF. SILVIA, PISO 8 APTO. 82;(0414) 443-52-99;V142162977;CARACAS
965;INSAFARMA, C.A.;CALLE MARTINEZ CON CALLE MARCANO, SECTOR CENTRO .  Estado Nueva Esparta. Municipio Mariño. Parroquia Santiago Mariño. Porlamar;(0414) 304-95-94;J401655092;INTERIOR
966;FARMA CLUB, C.A.;CALLE RAFAEL LONGORIA, CC VICTORIA CENTER, NIVEL P-B, LOCAL 59, SECTOR CENTRO, LA VICTORIA. EDO. ARAGUA;(0244) 322-55-66;J310153370;CARACAS
967;FARMACIA DISTRIBUIDORA TRANSFARMED C.A;Carretera Panamerica km21 Edificio Centro Profesional La Cascada Piso PB-L7 Sector Colinas de Carrizal Miranda Zona Postal 1203.  Estado Miranda. Mun;(0412) 587-83-53;J500605382;CARACAS
968;FUNDACION FRANCESCHI FREITES (FUNDAFARMACOS) SUCURSAL;AV FUERZAS AÉREAS CRUCE CON JOSÉ LUIS RAMOS, ANTIGUA SEDE FUNDAFAMILIA, URB LAS ACACIAS, MARACAY ESTADO ARAGUA.;(0424) 315-56-34;J-309491970.;CARACAS
969;FARMACIA FARMA + CA;CALLE PASEO CULTURAL RAMON VASQUES BRITO C.C BOULEVARD PORLAMAR NIVEL U, LOCAL A-1 CONJUNTO RESIDENCIAL ANTIGUO AEROPUERTO. ESTADO NUEVA ESPARTA. MUNI;(0424) 847-57-25;J500001665;CARACAS
970;FARMACIA SUFARMA C.A;CUARTA CARRERA ENTRE CALLE 13 Y 14 SUR MUNICIPIO SIMÓN RODRIGUEZ PARROQUIA EDMUNDO BARRIOS 3/. EL TIGRE;(0414) 794-89-94;J402343574;CARACAS
971;FARMA MOLL, C.A;AV. LA PAZ EDIF EXPOMUEBLES LAS AMERICAS PISO 1 LOCAL P/B SECTOR CENTRO MATURÍN MONAGAS ZONA POSTAL 6201.;(0412) 609-15-53;J500161255;INTERIOR
972;FARMACIA SAN VALENTIN FLORENCIO JIMENEZ;AV FLORENCIO JIMENEZ KILOMETRO 8 LOCAL S/N BARRIO NEGRO PRIMERO FRENTE A LA ESTACION DE SERVICIO TEXACO BARQUISIMETO EDO LARA;(0414) 253-90-71;J500443285;INTERIOR
973;FARMACIA SAN VALENTIN LA 25, C.A.;CALLE 25 ENTRE AVENIDA VENEZUELA Y CARRERA 27 LOCAL
NRO 26-47 SECTOR CENTRO BARQUISIMETO LARA ZONA POSTAL 3001;(0424) 542-07-44;J500280866;INTERIOR
974;INVERSIONES GASANROD C.A;CALLE RAUL LEONI, LOCAL N°1, PB SECTOR EL BARBECHO LOS TEQUES..  ESTADO MIRANDA. MUNICIPIO GUAICAIPURO. PARROQUIA LOS TEQUES.;(0412) 587-83-53;J412726536;CARACAS
975;FARMACIA LA PRINCIPAL C.A;Av.Principal Nueva Valencia C/C Calle Venezuela Local NRO 02 Barrio Fundación CAP Sector 1 Tocuyito Carabobo.  Estado Carabobo. Municipio Libertador;(0414) 421-09-37;J500455674;INTERIOR
976;FARMACIA SOFI SALUD AZCUE, C.A;CALLE AZCUE CARRERA 9 EDIF MORVE PISO PB LOCAL B SECTOR CENTRO.;(0414) 889-90-05;J412281224;INTERIOR
977;FARMACIA AVENIDA LA PAZ, C.A;Av. La Paz, Qta Numero 50-1 - Sector Las Avenidas - Maturín, Edo. Monagas - Zona Postal 6201;(0424) 909-54-64;J-403060983;CARACAS
978;DAGAFARMA, C.A;CALLE 1 ENTRE AV. LUIS DEL VALLE GARCÍA Y AV. FUERZAS ARMADAS CASA ANEXO LOCAL NRO 7 SECTOR LAS AVENIDAS MATURÍN MONAGAS ZONA POSTAL 6201.;(0412) 876-65-77;J500501749;INTERIOR
979;PHARMA MEDICA NAZARETH, C.A;CR-8A ANTIGUA CALLE PIAR CASA NÚMERO 83 LOCAL B SECTOR CENTRO MATURÍN ESTADO MONAGAS.;(0424) 950-44-50;J406371068;INTERIOR
980;FARMACIA EXITOSAAS 2104 C.A.;C.C. ESPACIO LA CEIBA, NIVEL HIPERMERCADO, LOCAL H-11, SECTOR LA CEIBA.  Estado Carabobo. Municipio Valencia. Parroquia Urbana San José. Valencia;(0414) 411-37-77;J313396532;CARACAS
981;CORPORACION EUROMEDICAL, C.A;CR CACHAMAY CON CALLE ARO CC BABILONIA MALL NIVEL MEZANINA 2 LOCAL M2-19  SECTOR PUERTO ORDAZ CIUDAD GUAYANA BOLIVAR ZONA POSTAL 8050;(0426) 373-64-07;J-411449768;CARACAS
982;CRISTY PHARMA, C.A;AV. LA PAZ QTA RIK NRO 37 SECTOR LAS AVENIDAS MATURÍN MONAGAS ZONA POSTAL 6201.;(0424) 940-50-21;J-410909625;INTERIOR
983;DISTRIMED LG, C.A;CALLE CRISTOBAL ROJAS, QUINTA VILLA AUGUSTA, SANTA MONICA;(0414) 230-04-26;J-307844019;CARACAS
984;FARMA MARKET PAMPATAR, C.A.;AV. JOVITO VILLALBA, SECTOR SAN LORENZO, EDF  VIVALCO PB LOCAL A Y B, PAMPATAR EDO. NUEVA ESPARTA;(0424) 186-94-13;J400818745;INTERIOR
985;FARMACIA FARMA LARA, C.A;AV LARA CRUCE CON AV 102 (MONTES DE OCA) No 95-18 CALENDARIA.  Estado Carabobo. Municipio Valencia. Parroquia Urbana Candelaria. Valencia;(0414) 583-73-37;J500307250;INTERIOR
986;CORPORACION FARMACEUTICA ECO FULL 2020,C.A.;CR CARUACHI UD 260 C.C.CENTRO EMPRESARIAL 303, PB, LOCAL PB-1 SECTOR ALTA VISTA, PARROQUIA UNIVERSIDAD, PUERTO ORDAZ-EDO.BOLIVAR;(0414) 856-81-75;J-500392605;CARACAS
987;FARMACIA M & M MARQUEZ MARCANO, C.A;CALLE 17 CON CARRERA 9 EDIF HOTEL POSADA "LA GABBIA" PISO 1 LOCAL B SECTOR CENTRO MATURÍN MONAGAS ZONA POSTAL 6201.;(0414) 786-43-42;J404684050;INTERIOR
988;OPTIFARMA, C.A;AV. LUIS DEL VALLE GARCÍA CARRERA 9-A CON CALLE 6 EDIF CENTRO DE CONSULTA SOFIA PISO PB LOCAL 10 SECTOR LAS AVENIDAS MATURÍN MONAGAS ZONA POSTAL 6201.;(0424) 919-84-97;J500499035;INTERIOR
989;FARMACIA ROJAS C.A.;AV. ARANZAZU LOCAL BRO. 57-A  BARRIO MIGUEL ACHE ZONA POSTAL 2003;(0412) 474-17-18;J-075770021;CARACAS
990;FARMA VIP C.A.;CALLE RAFAEL LONGORIA C.C. VICTORIA CENTER LOCAL A-15 LA VICTORIA EDO.ARAGUA.;(0424) 318-81-98;J401214037;CARACAS
991;PAPAPA FARMACIA CA;Calle Soublette cruce con Ambrosio plaza nro 17 edificio Falcon Crest V PB local 03 Urbanizacion El Bosque Maracay- Aragua Zona postal 2102;(0241) 241-94-77;J500193092;CARACAS
993;FARMA VIP C.A;CALLE RAFAEL LONGORIA C.C. VICTORIA CENTER LOCAL A-15 LA VICTORIA EDO. ARAGUA;(0414) 318-81-98;J-401214037;CARACAS
994;DROGUERIA DRO-MAX XXI, CA;AV. LIBERTADOR LOCAL TORRE MARACAIBO NRO. 1D1. SECTOR EL RECREO. CARACAS.;(0412) 918-97-01;J4100080612;CARACAS
995;FARMACIA CORAZON DE MARIA CA;CALLE LIBERTAD CASA NRO S.N ZONA CENTRAL DE SANTA ANA MUNICIPIO GOMEZ.;(0416) 326-79-58;J295252153;INTERIOR
996;RODRIGUEZ FARMACIA CIUDAD CA;CALLE CEDEÑO CC CUMANA LOCAL S/N SECTOR CENTRO BARINAS BARINAS ZONA POSTAL 5201;(0424) 520-84-69;J-500690673;CARACAS
997;FARMACIA ADMINISTRADORA LANNISTER, C.A.;AV MARISCAL SUCRE EDIF LOS SAUCES PISO 3OF 3-C URB SAN BERNARDINO CARACAS DISTRITO CAPITAL ZONA POSTAL 1415;(0426) 750-13-84;J-411334553;CARACAS
998;DROGUERIA CORPORACION E.H.G.A.D.U , C.A;AV EL ESTADIUM CON CALLE ABOGADOS EDF. MONTE CARMELO  PISO PB OF2 URB LOS CHAGUARAMOS. CARACAS;(0426) 404-54-40;J-411567329;CARACAS
999;FARMACENTRO I C.A.;AV CRUZ CARRILLO LOCAL COMERCIAL S/N SECTOR CENTRO. EDO TRUJILLO. MUNICIPIO TRUJILLO . PRRQ. CRUZ CARRILLO.;(0412) 160-86-50;J500438192;INTERIOR
1000;FARMACIA EL PINGUINO JUNIOR, C.A.;CALLE AVENIDA MIRANDA ENTRE CALLE IGUALDAD Y MARCANO SECTOR CENTRO EDO. NUEVA ESPARTA;(0426) 596-64-80;J403148309;INTERIOR
1001;FARMACIA VENUS C.A.;AV ESTE O DE PARADEROS A VENUS EDIF INA LOCAL 14 LA CANDELARIA. CARACAS.;(0414) 303-77-82;J302949467;CARACAS
1002;FARMACIA CASANOVA VIÑEDO, C.A.;CALLE 138, CASA N° 105-37, URBANIZACIÓN EL VIÑEDO, MUNICIPIO VALENCIA, ESTADO CARABOBO.  Estado Carabobo. Municipio Valencia. Parroquia Urbana San Jo;(0412) 305-66-04;J409089410;INTERIOR
1003;FARMA GLOBAL, C.A;AV 181 CC PROFESIONAL BIARRITZ NIVEL PB LOCAL PB-4 SECTOR S/N NAGUANAGUA CARABOBO ZONA POSTAL 2005;(0424) 968-69-60;J-500394080;CARACAS
1004;FARMACIA METROESTACION C.A;CALLE 107 (NAVAS SPINOLA) EDIF ARENAS DE VALENCIA PISO B LOCAL COMERCIAL N° 3, NRO CIVICO 100-21 SECTOR VALENCIA VALENCIA CARABOBO ZONA POSTAL 2001;(0414) 584-08-28;J403383308;CARACAS
1005;FARMACIA MEDICA DOS, C.A;AV BOLIVAR LOCAL NRO L-5 SECTOR CASCO CENTRAL;(0414) 584-08-28;J311620338;CARACAS
1007;FARMACIA FARMA FERIA, C.A;AV 100 (LAS FERIAS) LOCAL NRO S/N BARRIO 13 DE SEPTIEMBRE, NRO CIVICO 65-16 VALENCIA CARABOBO ZONA POSTAL 2001;(0414) 584-08-28;J500306792;CARACAS
1008;FARMACIA LA CAMPIÑA,C.A;VENIDA UNIVERSIDAD CENTRO COMERCIAL UNIVERSO, NIVEL PB, LOCAL 8, URBANIZACION LA CAMPIÑA.;(0414) 584-08-28;J310735255;CARACAS
1009;FARMANSELMO C.A;CSLLE LAURENCIO SILVA CC URDANETA N° 92 ZONA SAN AGUSTIN GUACARA EDO CARABOBO.;(0414) 584-08-28;J296995877;CARACAS
1010;FARMACIA GRAN MI LLANO,C.A;V PRINCIPAL HERRY FORD VEREDA 10 SECTOR 07 LOCAL NRO 01 URB LA ISABELICA;(0414) 584-08-28;J299956597;CARACAS
1011;FARMATUYA 1, C.A.;CALLE PRINCIPAL, LOCAL N.-1 EDI CARACOLILLO (ANTOGUAO BANCRECER) SECTOR NUEVA CARACAS, PLAZA PEREZ BONALDE.;(0212) 243-17-23;J500379617;CARACAS
1012;FARMACIA GUAMACHE, C.A.;CALLE PRICA LOCAL NRO FS-1 SECTOR CONEJEROS;(0424) 894-01-21;J298904976;INTERIOR
1013;DROGUERIA AMEPACA C.A;CALLE 8 EDIF MESSINA PISO 1 LOCAL 1 SECTOR LA PLATA 1 VALERA EDO TRUJILLO.;(0414) 979-34-62;J309299522;INTERIOR
1014;FARMACIA TERRAS, C.A;AVENIDA PRINCIPAL TERRAZAS DEL CLUB HÍPICO, CENTRO COMERCIAL TERRAS PLAZA, NIVEL C-1, LOCAL P1-L11, TERRAZAS DEL CLUB HÍPICO, CARACAS;(0212) 976-20-07;J313477508;LISTA FMKT
1015;FARMACIA AUTOMERCADOS PLAZAS VALLE ARRIBA;CENTRO COMERCIAL VALLE ARRIBA MARKET CENTER, NIVEL PLANTA AUTOMERCADO, LOCAL NM-1, AV. A CON CALLE C, URB. COLINAS DE VALLE ARRIBA.;(0424) 287-20-72;J306725024.;CARACAS
1016;FARMACIA AUTOMERCADOS PLAZAS LOS NARANJOS;ENTRE CALLE EL PAUJÍ AV. PPAL LOS NARANJOS, CENTRO COMERCIAL LOS NARANJOS, NIVEL PLAZA, LOCAL PB. 12,13,14,15, LOS NARANJOS.;(0212) 985-35-60;J306725024;CARACAS
1017;FARMACIA AUTOMERCADOS PLAZAS GALERIAS;CENTRO COMERCIAL GALERIAS PRADOS DEL ESTE, PLANTA BAJA, Nº PB-10 AV. PRINCIPAL DE PRADOS DEL ESTE.;(0212) 975-44-84;J306725024..;CARACAS
1018;FARMACIA FARMA RENEE, C.A. (SUCURSAL3);CALLE CEDEÑO CRUCE CON AV. CUMANA LOCAL 19-53. SECTOR LA CAROLINA BARINAS ESTADO BARINAS;(0424) 563-97-76;J-412839373;CARACAS
1019;FARMACIA REINO DE VALENCIA, C.A;AV ANDRES ELOY BLANCO CC EUROCENTER NIVEL PLANTA BAJA LOCAL 03 SECTOR S/N VALENCIA CARABOBO ZONA POSTAL 2001;(0416) 679-84-26;J500526695;INTERIOR
1020;FARMACIA CENTRAL PLAZA, C. A;CALLE 58, AVENIDAD SESQUICENTENARIA, N°100-80 CENTRO COMERCIAL PETROS PLANTA BAJA LOCAL 13 MUNICIPIO VALENCIA ESTADO CARABOBO. 
Estado Carabobo. Muni;(0412) 436-70-77;J500647174;INTERIOR
1021;FARMACIA SANTA ROSA MARACAY 2011, C.A.;AVENIDA CARABOBO SURCRUCE CON CALLE SAN MIGUEL LOCAL NRO 51 BARRIO SANTA ROSA MARACAY-ARAGUA;(0414) 489-24-83;J400572762;CARACAS
1022;FARMACIA ALOE CA.;AV. MONSEÑOR ADAMS CCP MONSEÑOR ADAMS LOCAL 1 Y 2 PLANTA BAJA URB. EL VIÑEDO.  Estado Carabobo. Municipio Valencia. Parroquia Urbana San José. Valenc;(0424) 409-33-01;J301506472;INTERIOR
1023;FARMACIA ANADRI C.A;CALLE RICAURTE CON CALLE PAEZ,NRO.32,SECTOR PUEBLO DE BARUTA .  Estado Miranda. Municipio Baruta. Parroquia Baruta. Caracas;(0412) 921-57-36;J299313262;CARACAS
1024;FARMACIA GALA I C.A;CENTRO COMERCIAL EL TOCO, LOCAL 1-A ENCRUCIJADA VIGIRIMA-YAGUA. 
ESTADO CARABOBO. MNCPIO GUACARA. PRRQ. NO URBANA YAGUA. GUACARA;(0412) 409-20-65;J401537995;INTERIOR
1025;FARMACIA GALA III CENTRO, C.A;AVENIDA BOLIVAR CRUCE CON JACINTO LARA, LOCAL N°122-1 SECTOR LA GUAJIRA MUNICIPIO GUACARA ESTADO CARABOBO. MNPIO. GUACARA;(0424) 456-83-76;J500361629;INTERIOR
1026;FARMACIA GALA IV AV. LARA, C.A;AVENIDA LARA CRUCE CON SOUBLETT CENTRO COMERCIAL VALENZANO PIAZZA NIVEL 95-A-55 LOCAL Nª4 VALENCIA ESTADO CARABOBO. VALENCIA;(0412) 870-48-13;J500435207;INTERIOR
1027;FARMACIA GALA V AV BOLIVAR, C.A;CALLE 135 CIVICO 99-A-100 EDIF HAWAY PISO PB LOCAL 7 URB LOS SAUCES VALENCIA CARABOBO .  Estado Carabobo. Municipio Valencia. Parroquia Urbana San Jo;(0412) 409-20-65;J500478283;INTERIOR
1028;FARMACIA GALA II CA;CALLE AREVALO GONZALEZ, LOCAL 123, SECTOR NEGRO PRIMERO MUNICIPIO GUACARA, ESTADO CARABOBO. 
Estado Carabobo. Municipio Guacara. Parroquia Urbana Gua;(0412) 409-20-65;J412067621;INTERIOR
1029;MUNDOFARMA C.A;AV NUEVA ESPARTA CC SIMBAD NIVEL PLANTA BAJA LOCAL S/N SECTOR VENECIA BARCELONA EDO. ANZOATEGUI;(0424) 328-92-71;J-412369458;INTERIOR
1030;JHONHEIBER OSWALDO CASTRO OLIVARES;CARACAS;(0424) 239-87-26;22021610;CARACAS
1031;FARMACIA EL SOL II, C.A.;AV. BOLIVAR C.C. LA HORMIGA CENTER LOCAL # 1 MARACAY ESTADO ARAGUA.  Estado Aragua. Municipio Girardot . Parroquia Urbana Madre María de San José . M;(0416) 040-27-70;J309324985;CARACAS
1032;FARMACIA DUGARTE FARMACIA ALTAMIRA F.P.;AVENIDA PIE DE MONTE, CALLE SUIZA, CC TIERRA DORADA,NIVEL PB, LOCAL 74, SECTOR ALTO BARINAS;(0424) 506-87-38;V-042614250;CARACAS
1033;FARMACIA GLOBALSALUD;AV JUNCAL, ENTRE AV. BOLIVAR Y CALLE MONAGAS EDIF VICENTE RIVAS PISO P.B. LOCAL 2 SECTOR CENTRO MATURIN MONAGAS ZONA POSTAL 6201.;(0424) 942-33-44;J400220769;INTERIOR
1034;UROFARMA C.A.;CALLE 11 ENTRE CARRERAS 19 Y 20,CASA NRO.19-50, BARRIO OBRERO, SAN CRISTOBAL TACHIRA ZONA POSTAL 5001;(0276) 355-88-86;J-500688431;CARACAS
1035;ALBERTO AMUNDARAIN;PUERTO ORDAZ;(0424) 941-05-17;22719252;CARACAS
1036;FARMACIA PUNTO BLANCO C,A;CALLE 101 CC WHITE POINT NIVEL P.B LOCAL 4 Y 5 URB. BASE ARAGUA..  Estado Aragua. Municipio Girardot . Parroquia No Urbana Choroní . Maracay;(0243) 233-59-89;J298944943;CARACAS
1037;FARMACIA PUNTO BLANCO C.A;CALLE 101 C.C WHITE POINT NIVEL P.B LOCAL 4 Y 5 URBANIZACION BASE ARAGUA MARACAY-ARAGUA;(0243) 233-59-89;J-298944943;CARACAS
1038;FARMACIA MIRADOR, C.A.;AV 102 UNIVERSIDAD No CIVICO 190-91 EDIF. TRIMAR PISO PB LOCAL COMERCIAL No 1 SECTOR NAGUANAGUA EDO. CARBOBO .;(0412) 943-34-39;J075828801;CARACAS
1039;FARMACIA SAN PATRICIO, C.A;AV EL EJERCITO EDIF SAN JOSE PISO PB LOCAL 2 URB ALTO LOS GODOS MATURÍN  MONAGAS ZONA POSTAL 6201.;(0424) 931-44-45;J500802285;INTERIOR
1040;FARMACIA Y COMERCIALIZADORA ABIEL EFRATA, C.A;VIA PRINCIPAL DE TIPURO, C.C COMUNITARIO NORTE, LOCAL 2 DIAGONAL AL C.C VIRGEN DEL VALLE.;(0412) 878-02-92;J409478734;INTERIOR
1041;FARMA MARQUEZ BARQUISIMETO, C.A;AV VARGAS ENTRE CARRERAS 22 Y 23 EDIF GUSTAVO PISO P/B LOCAL S/N SECTOR CENTRO BARQUISIMETO LARA ZONA POSTAL 3001;(0251) 232-17-43;J500305303;INTERIOR
1042;FARMACIA FARMA MAS DESCUENTOS VII C.A.;AV MONTES DE OCA CC CARIBBEAN PLAZA NIVEL 1 LOCAL 90 MODULO 5 SECTOR SAN JOSE VALENCIA CARABOBO ZONA POSTAL 2001;(0412) 412-89-48;J307258667;INTERIOR
1043;FARMACIA BOTIEXPRESS, C.A.;AV. INTERCOMUNAL DON JULIO CENTENO LOCAL NRO I16-I17, C.C. SAN DIEGO. . Estado Carabobo. Municipio San Diego. Parroquia Urbana San Diego. Valencia;(0424) 496-09-21;J404214542;INTERIOR
1044;FARMACIA VALENCIA TOLEDO, C.A;AVENIDA INTERCOMUNAL CC MEGAMERCADO NIVEL PB LOCAL 78PB SECTOR PARQUE VALENCIA VALENCIA CARABOBO ZONA POSTAL 2003;(0424) 461-98-67;J-413268051;INTERIOR
1045;FARMACIA LA FORMULA CA;AV. UNIVERSIDAD LOCAL NRO 190-78 SECTOR NAGUANAGUA, CARABOBO;(0414) 416-76-97;J-075923600;CARACAS
1046;FARMACIA FARMA ACTUAL LA REDOMA, C.A;CALLE 08 LOCAL NRO 1 SECTOR ANTIGUA ARTIGA MATURÍN MONAGAS ZONA POSTAL 6201.;(0414) 851-56-79;J410880619;INTERIOR
1049;FARMACIA SATELITE, C.A;AVENIDA BOLIVAR CRUCE CON CALLE VARGAS CASA LOTE N.-2 SAN JOAQUIN .;(0414) 447-51-76;J296930821;INTERIOR
1050;FARMACIA MALANGA CA;AV. BOLIVAR CC PARQUE ARAGUA NIVEL 2 LOCAL 58-B, SECTOR PARQUE ARAGUA, MARACAY ESTADO ARAGUA;(0412) 433-08-05;J299342920;CARACAS
1051;FARMACIA SEBAOT SEÑOR DE LOS EJERCITOS C.A.;CALLE D, NRO 88-75 LOCAL NRO 2 URB LA QUIZANDA VALENCIA CARABOBO ZONA POSTAL 2003;(0414) 411-60-07;J404912118;INTERIOR
1052;FARMACIA ADRENALINA Y SALUD C.A;AV. BOLIVAR CON CALLE PROGRESO NO2 LOCAL A-2 SECTOR S/N CENTRAL TACARIGUA CARABOBO ZONA POSTAL 2010.;(0414) 597-39-44;J500526830;INTERIOR
1053;FARMACIA JGBRAND, C.A;AVENIDA LARA ENTRE CALLE ANZOATEGUI Y BRICEÑO MENDEZ CENTRO COMERCIAL VILLA LARA NIVEL 1 LOCAL 3 SECTOR LA CANDELARIA VALENCIA ESTADO CARABOBO.;(0424) 406-82-11;J412225014;INTERIOR
1054;TODOHOGAR VISTAMAR C.A;AVENIDA ARIZALETA CRUCE CON CALLE 12 DE OCTUBRE EDIFICIO VALENTIN GUANTA ESTADO ANZOATEGUI.;(0424) 854-45-33;J311876103.;INTERIOR
1055;TODOHOGAR VISTAMAR,C.A.;AV. INTERCOMUNAL, CENTRO COMERCIAL VISTAMAR, PLANTA BAJA, LOCAL Nº 17, LECHERÍAS, EDO. ANZOÁTEGUI .;(0424) 854-45-33;J311876103..;INTERIOR
1056;TODOHOGAR VISTAMAR C.A.;AV. INTERCOMUNAL, JORGE RODRIGUEZ, CC VISTAMAR NIVEL PB LOCAL 17 SECTOR VISTAMAR, LECHERIAS - ANZOATEGUI .;(0424) 854-45-33;J311876103...;INTERIOR
1057;TODOHOGAR VISTAMAR, C.A.;AV. INTERCOMUNAL, JORGE RODRIGUEZ, CC VISTAMAR NIVEL PB LOCAL 17 SECTOR VISTAMAR, LECHERIAS - ANZOATEGUI .;(0424) 854-45-33;J311876103;INTERIOR
1058;ESTEPA FARMACIA, C.A.;CALLE FEDERACION LOCAL COMERCIAL BALOA NRO. 5 ZONA PETARE CARACAS (PETARE) MIRANDA ZONA POSTAL 1070. Estado Miranda. Municipio Sucre. Parroquia Petare;(0212) 614-15-79;J317108019;CARACAS
1059;FARMACIA ALBECAR II C.A.;AV. PPAL DE PALO VERDE EDF. TOCUYO PB LOCAL 1 MUNICIPIO SUCRE EDO MIRANDA. Estado Miranda. Municipio Sucre. Parroquia Petare. Caracas;(0212) 614-15-79;J308784478;CARACAS
1060;FARMACLUB CENTRO, C.A.;AVENIDA FRANCISCO DE LORETO, EDIF ANIN PB LOCAL 5 SECTOR CENTRO. ESTADO ARAGUA .;(0414) 493-55-90;J298781548;CARACAS
1061;FARMACLUB COLON, C.A.;CALLE COLON, CALLE BLANKLOCAL N° 52 SECTOR CENTRO LA VICTORIA EDO ARAGUA ZONA POSTAL 2121.;(0412) 896-28-51;J316248399;CARACAS
1062;FARMACLUB LAS MERCEDES, C.A.;AV. 1 CON CALLE AV. 2 CC LA VICTORIA NIVEL PB LOCAL 1 URB. LAS MERCEDES SECTOR LA VICTORIA EDO. ARAGUA ZONA POSTAL 2121.;(0424) 348-49-76;J408447827;CARACAS
1063;FARMACIA COROMOTO, FARCO, S.R.L.;AV AYACUCHO, CRUCE CON AV MIRANDA OESTE, N° 11, EDIFICIO DUMITH, PLANTA BAJA N°1.;(0243) 246-39-63;J075278267;CARACAS
1064;FARMACIA LA AVENIDA, C.A. SUCURSAL;C.C.LA COLINA NIVEL C-1 LOCAL C1-01 . 
Estado Miranda. Municipio Los Salias. Parroquia San Antonio de Los Altos. Los Teques;(0212) 371-00-30;J-001408533.;CARACAS
1065;FARMACIA POPULAR TIUNA, CA;AV. BOLIVAR OESTE, CENTRO COMERCIAL TIUNA NIVEL PB, LOCAL 6 SECTOR LA ROMANA, MARACAY - EDO. ARAGUA;(0424) 315-09-46;J-407659138;CARACAS
1066;FARMACIA MARIA NIEVES 66, C.A. (SICM 23684);AVENIDA MARIA NIEVES CURCE CON CALLE SANTA ROSA Y AVENIDA CARACAS SECTOR NORTE, LOCAL 113.;(0414) 475-08-12;J404792368;INTERIOR
1067;FARMACIA POPULAR TIUNA C.A;AV. BOLIVAR OESTE, CENTRO COMERCIAL TIUNA NIVEL PB, LOCAL 6 SECTOR LA ROMANA, MARACAY - EDO. ARAGUA;(0424) 315-09-46;J407659138;CARACAS
1068;FARMASOL 2020, C.A.;AV. JOSE MARIA VARGAS LOCAL ROCAMAR NRO 2 SECTOR CENTRO PAMPATAR  EDO. NUEVA ESPARTA;(0414) 223-30-45;J500410980;INTERIOR
1069;FARMACIA  IMPORTMEDICA R.G. CA;AV BOLIVAR NORTE CC ESPACIO LA CEIBA NIVEL BOLIBAR,LOCAL B-14 8-04 CASERIO VALENCIA CARABOBO;(0424) 415-55-28;J-314921525;CARACAS
1070;FARMACIA MONTE SINAI C.A;CENTRAL TACARIGUA SECTOR BOQUERON, CARRETERA MANUARE LOCAL 100 20.  Estado Carabobo. Municipio Carlos Arvelo. Parroquia No Urbana Tacarigua. Guigue;(0412) 400-34-66;J311628665;INTERIOR
1071;GRUPO FARMACIAS EMAUS, C.A;AV. BOLIVAR LOCAL NRO. 24SECTOR CENTRO MARACAY ARAGUA;(0412) 412-36-00;J402067127;CARACAS
1072;RATTAN HYPERMARKET, C.A;AV. ALDONZA MANRIQUE CON JOVITO VILLALBA CC K ETAPA I URB PLAYA EL ANGEL PAMPATAR  EDO. NUEVA ESPARTA;(0424) 853-08-08;J313383309;INTERIOR
1073;DROGUERIA VIVE 2009, C.A.;calle el paraiso, con calle las flores,edf. Ofigarel, piso 6- local 6CUrb. Sabana grande;(0414) 121-49-99;J-297194827;CARACAS
1074;CAREPHARMA C.A.;calle 9, Edf, comercial industrial, piso 1, local,3. la urbina;(0414) 131-00-10;J-412770751;CARACAS
1075;DROGUERIA MEDICA SION C.A.;alle 11-1, Edificio GE-33,Zona Industrial La Urbina..  Estado Miranda. Municipio Sucre. Parroquia Petare. Caracas;(0212) 242-67-81;J-413248068;CARACAS
1076;FARMACENTER CENTRO II .C.A;Calle Vargas Con Avenida Bolivar Edificio Invercosca II Piso PB Local 48 Sector Centro, Maracay estado Aragua.;(0414) 474-90-67;J412894714;CARACAS
1077;DOS MAS DOS MARKET, C.A.;AV PASEO CARONI CON CALLE CHURUN MERU MANZ 2 PARCELA 1 LOCAL NRO 1 SECTOR UD 264 ALTA VISTA PUERTO ORDAZ.;(0414) 263-33-16;J500361319;INTERIOR
